질문,답변
계약 기간 월 일이 고 계약 종료 일 월 일인 토지 임대 계약 을 하다 법인 사 업체 이다 이번 분기 부가세 신고 하다 월 분 에 대한 간주 임대료 를 신고 하다 부동산 임대 공급 가액 명세서 작성 하다 자동 으로 퇴거 일이 월 일로 입력 되다 실제 퇴거 일이 월 일 인데 상관 없다 궁금하다,퇴거 일이 월 일로 기재 되어다 있다 경우 에도 세액 에 영향 은 없다 해당 과세 기간 내 퇴거 가 이루어지다 않다 경우 에는 퇴거 일 을 공란 으로 두다 것 이 맞다
부동산 계 약시 중개사 없이 거래 하다 차후 문제 가 되다 한 내용 이 무엇 이다 요 부동산 중개 료 아끼다 알 지만 뭔가 걱정 이 되다,집 에 대한 권리 적 인 내용 집의 상태 에 대한 내용 을 아무래도 직접 다 챙기다 겠다 그런 것 들 을 자다 챙기다 수 있다 직거래 도 좋다
안녕하다 앞뒤 사정 거두 절미 하고 너무 길어지다 부동산 취득 신고 에 문제 가 생기다 제 앞 으로 부동산 과태료 가 천만원 에 나오다 달마 다 안내면 가산 세 가 만원 씩 붙다 있다 허다 제 가 지금 신용 불량 자 상태 이며 월 수입 도 많다 않다 재산 도 없다 한번 에 완납 하다 수가 없다 상황 이다 과태료 금액 을 좀 내리다 분할 납입 하다 수도 있다,개인 간 경제 적 인 사유 로 인하다 과태료 를 면제 하다 것 은 불가능하다 정확하다 사항 은 관할 지자체 에 문의 하다 답변 받다 것 이 적절하다 보이다
안녕하다 부동산 에 관심 이 많다 부리다 이다 제목 그대로 권리분석 이라는 말 이 있다 정확하다 어떤 건 지 궁금하다 쉬다 설명 해주다 감사하다,부동산 거래 를 하다 대상 부동산 의 권리 등 에 하자 가 있다 여부 가 궁금하다 그것 이 아주 복잡하다 전문 적 인 일 이어서 거래 당사자 가 완전하다 분석 하다 것 은 어렵다 일 이다 이러하다 분석 을 하다 이유 는 간단하다 파악 하다 어렵다 부동산 등기 의 소유권 및 각종 권리 관계 의 결함 을 발견 하다 부동산 과 관련 되다 사고 를 미리 예방 하다 위해 서 이다 부동산 등기부 의 부동산 의 물건 을 표시 한 내용 으로 소재지 면적 동 호수 등 그 부동산 의 소유권 및 지상권 지역권 전세권 저당권 임차권 등 의 설정 과 그 변동 가등기 압류 등기 가압류 등기 가처분 등기 등 에 관 한 사항 토지대장 의 토지 의 소재지 지번 지목 면적 소유자 공유 여부 공유 지 분 공유 자 대지 권 등기 여부 대지 권 비율 소유자 등 에 관 한 사항 이 있다 건축물 대장 은 건축물 의 면적 구조 용도 층수 부소 건축물 의 현황 등 에 관 한 사항 위반 건축물 등재 여 부토 지 이용 계획 확인 원 에서는 해당 지역 의 토지 이용 도시 계획 시설 결정 여부 및 규제 등 에 관 한 사항 이 있다 위 와 같다 상황 들 을 파악 하다 위 한 종합 적 인 검토 를 권리분석 이라 하다
부동산 매매 에 따르다 소유권 의 등기 명의 인 이 등기 의무 자 로서 등기 를 신청 하다 경우 매도 인 이 제출 하다 하다 인감증명 의 유효 기간 은 어떻다 되다,등기 신청서 에 첨부 하다 인감증명 법인 등기 사항 증명서 주민등록 표 등본 초본 가족 관계 등록 사항 별 증명서 및 건축물 대장 토지대장 임야 대장 등본 은 발행 일 부터 개월 이내 의 것 이다 하다
갑 과 을 이 자기 가 가지 고 있다 토지 를 교환 하다 경우 에 취득세 를 납부 하다 취득 가격 은 시세 인지 시가 표준 액 인지 아니다 다른 가격 이 있다,본인 이 토지 를 실제 취득 하다 지출 한 가격 이 취득 당시 의 가액 이 되다 것 이다 즉 본인 이 을 의 토지 를 취득 하다 본인 토지 를 지불 하다 본인 토지 의 가액 이 취득 가액 이 되다 것 이다 토지 의 경우 사실 상 매매 가격 이 없다 공시가격 을 취득 가액 으로 하다 되다 자세하다 사항 은 관할 지자체 에 문의 를 해보다 되다
안녕하다 요즘 수도권 에서 신고 가로 계약 되다 아파트 들 의 등기 내 역 을 대법원 등기 정보 광장 에서 조 회시 나오다 않다 경우 가 있다 하다 이러하다 경우 는 어떻다 사례 혹은 예시 를 들어서다 추측 이 가능하다 요,집값 띄우기 로 불리다 부동산 시 세 조작 이 부동산 시장 을 교란 하고 있다 것 으로 보이다 거래 가 잠잠하다 시세 가 보합 을 보이다 상황 에서 최고 가 거래 를 띄우다 뒤 몇 달 뒤 에 계약 을 해제 하다 방식 으로 사실 상 정상 적 인 거래 를 방해 하다 것 이다 가격 이 오른 줄 알 고 계약 을 체결 하다 자칫 고 점 에서 물리다 실수 요 자가 발생 하다 수도 있다 이 같다 허위 거래 는 매 수인 이 계약 후 실 거래 가 신고 는 하 되다 부동산 소유권 이전 등기 는 하다 않다 특징 을 보이다 실 거래 가 신고 제도로 인하다 계약서 작성 후 일 이내 실 거래 신고 를 하다 되다 점 을 이용 한 겁니다
안녕하다 최근 부동산 시세 조작 의혹 과 관련 하다 부동산 계약 후 계약 해지 가 시장 에 혼란 이 있다 수 있다 하다 이렇다 실제 로 가능하다 그리고 이러하다 계약 은 네이버 부동산 등 에 어떻다 시 세 반영 이 되어다 있다 건지다 궁금하다,사 인간 의 계약 즉 개인 과 개인 간 의 계약 관계 는 두 당사자 간 합의 를 우선하다 때문 에 계약 을 하다 난 뒤 해지 또한 가능하다 그리고 계약 일로 부터 이다 부동산 거래 신고 의무 가 있다 계약 일과 잔 금일 간의 공백 을 길다 뒤 신 고후 계약해지 를 진행 하다 있다 여지 가 있다 말 그대로 계약 이 해제 되다 실 거래 가다 해당 계약 이 해지 되어다 뜨다 거래 금액 은 남다 시 세 조작 이 가능하다 여지 가 있다 최근 개정 을 통해 신 고후 해 지시 해당 내 역 을 삭제 하다 조항 을 추가 한 것 으로 알 고 있다
부동산 으로 억 정도 하다 밭 이 있다 이 걸 판매 하다 하다 부동산 을 양도 하고 나다 세금 이 이래저래 나오다 대충 얼마 정도 나오다 요,양도소득세 는 기본 적 으로 양도 차 익양 도 가액 취득 가액 필요 경비 등 에 대해 과세 하다 것 이다 따라서 대략 의 양도소득세 를 산출 하다 최소한 취득 가액 과 보유 기간 비사 업다 토지 의 판단 등 이 필요하다
부동산 재개발 하다 예전 에 내 가 평 에 살 고 있다 재개발 하다 평 으로 늘리다 기존 살 고 있다 사람 들 은 어떻다 되다 가요 평 값 을 더 지불 하다 들어가다 하다 건지다 이다 그냥 분양 받다 들어가다 살수 있다 전문가 님 들다 의견 이 궁금 하다,재개발 개발 방식 에 따르다 다르다 만약 환지 로 진행 하다 되다 기존 원주민 들 에게는 입 주권 이 부여 되다 본인 이 선택 한 평수 와 기존 소유 주택 가치 에 따르다 차익 을 분담 금 으로 내다 되다 다만 일 반 분양 에 비다 저렴하다 입 주가 가능하다 재건축 의 경우 도 분담 금 이 있다 때문 에 사실 상 그 차익 만큼은 지급 하고 이다 되다
뉴스 를 보 니까 서울 부동산 가격 이 보합 에 그치다 그렇다 전국 부동산 가격 이 앞 으로 좀 오르다 가능성 이 엤 을 끄다 전문가 들 의 의견 이 궁금하다,현재 많다 전문가 들 이 내년 초 에 금리인하 를 예상 하고 있다 따라서 금리 가 인하 되다 시 에 부동산 경기 가 회복 되다 것 으로 보이다
부동산 임 장 을 나가다 꼭 살펴보다 하다 것 들 에 대해 간단하다 요약 해주다 예 를 들다 주변 지형 을 살피다 하다 인프라 가 어떻다 등 이 요,임 장 목적 에 따르다 중요도 가 다르다 임 장시 기본 적 인 확인 은 해당 매물 의 입지 교통 학군 인프라 등일 되다 것 이고 내 부적 인 확인 으로는 현 매물 의 지역 내 인지도 관리 현황 관리 비용 등 을 두루 확인 하다 하다 여기 에 경매 낙찰 목적 이 라면 현 점유 자 확인 관리 비 미납 여부 해당 아파트 내 경 매물 권 에 대한 조 사 등 이 있다 있다
좀 어처구니 없다 상황 이라서 어떻다 하다 하다 법적 으로 제 가 책임 을 지다 역전 세 비용 을 주다 하나요 녹취록 도 있다 이 것 도 그 전 세 세 입자 에게 주다 상황 은 학군 이 좋다 동네 목동 저 는 복층 빌라 임대 인 이고 전세 세 입자 억 천 월 일정 도 만 기 월 정도 에 부동산 통해 서 연락 이 오다 공시 시가 억 떨어지다 공시 시가 대비 만 전세 보증금 보증 이기 때문 에 억 천이 여야 한 다그 래서 억 을 돌려주다 역전 세 비용 개월 당 이자 약 만원 달라 고 하다 저 왈 그렇다 일단 억 천 에 반 전세 구 하다 억천 에 전세 세 입자 를 변경 하자 하다 달동 안 찾아보다 안되다 지불 하다 것 으로 통화 를 하다 그리고 분뒤 다시 전화 가 오다 전세 세 입자 도 광명시 아파트 에 억 역다 억 대출 받다 주어 여 하다 그래서 저 보고 계약 에 확답 이 필요 하다 하다 년 이 아니다 년 개월 이야기 하다 저 보고 역전 세 비용 을 주 라고 하다 계약 왈 부동산 신규 세 입자 찾아보다 어리다 것 같다 저 는 그냥 역전 세 계약 하다 네 알다 역전 세 이자 얼 마르다 월 이요 년 보다 년 개월 살 고 싶다 그렇다 일단 년 하고 추후 연장 하다 것 으로 통화 종료 하다 일 뒤 제 가 신규 전세 세 입자 억천 방 을 보다 간다 고 연락 하다 아침 부터 그런데 계속 거주 하다 거절 하다 아이 고등 학년 이니 년 후 학년 월 졸업식 까지 죠 그래서 저 는 내용증명 보내다 내 가 결정 내리다 건 달동 안 신규 세 입자 못 찾다 전 세 세 입자 를 바꾸다 못 하다 임차 인 에게 월 주다 이다 당신 이 방 을 보여주다 않다 내 가 전세 비용 돌려주다 수 없다 통화 내용 은 내 가 명백하다 달 찾아보다 해주다 하다 세 입자 내용증명 보내다 민법 어디 어디 위반 하다 것 이다 증거 는 내 녹취록 이다 그래서 년 동안 월 달라 이렇게 하다 이 거 내 가 역다 주다 하나요 저 는 어처구니 없다 묻다 법적 책임 이 있다 피해 를 준 것 인가요 내 가 전 세 비용 을 주다 하다 왜 나 한테 역전 세 월세 비용 을 달라 고 하다 수 있다 모르다,주택임대차보호법 상 임차 인 의 계약 갱신 시 임대 인 이 거절 하다 수 있다 사유 대표 적 으로 임대 인 본인 이 거주 하다 경우 임차 인과 협의 하다 경우 등 이 있다 다른 사유 는 위 질문 에 해당 되다 않다 임차 인 이 계약 갱신 요구 권 을 행사 하다 전 세 시세 가 하락 하다 보증금 억천만원 으로 하다 억원 정도 를 은행 에 반환 하다 계약 갱신 억원 에 대한 이자 를 임차 인 에게 매월 지급 하다 계약 갱신 임차 인과 협의 하다 계약 갱신 을 하다 않다 되다 이 경우 임자 인 에게 적절하다 보상 을 하다 하다 수도 있다
부동산 재계약 시 월세 를 끄다 올리다 있다 는걸 로 알다 그러면 임대 보증금 이 천만원 이라고 하다 보증금 은 월세 인상 에 반영 이 안되다 가요,보증금 도 이내 에서 협의 후 인상 가능하다 보증금 을 동결 하다 환산 월 차임 환산 보증금 때문 에 월세 를 보다 더 인상 하다 순 있다 환산 월 차임 환산 보증금 월세 전월세 전환율 보증금 이다 전월세 전환율 적용 가정 하 에 보증금 억 에 월세 만원 이 라면 인상 시 억만원 에 만원 으로 올리다 있다 보증금 억 을 동결 하고 월세 만 올린다 면 억 에 원 이내 에서 협의 후 인상 가능하다 참고 로 전월세 전환율 은 연 또는 한국은행 기준금리 금액 중 에 낮다 비율 을 적용 하다
오래전 부동산 매매 또는 임대차 계약 을 함 에 있다 공인 중개사 의 중개 계약 이 아니다 매매 인 또는 임대차 인 쌍방 간 에 계약 도 유효하다 답변 을 들다 이 경우 에 계약서 양식 은 공인 중개사 가 사용 하다 계약서 내용 에 준 하다 하다 기본 적 인 내용 물건 소재지 쌍방 간인 적 사항 물건 규모 금액 기간 등 만 포함 되다 정도 로 임의 양식 을 만들다 계약 하다 되다,네 공인 중개사 의 중개 계약 이 아니다 쌍방 간 에 계약 도 유효하다 주택 임대 사업자 등록 되다 임대 인 이 라면 법정 서식 인 장 짜다 표준 임대차 계약서 양식 을 사용 하다 하다 그 외다 달리 전해지다 양식 은 없다 시중 마트 에서 임대차 또는 매매 계약서 양식 을 구 하다 작성 하다 무방 하다 전 세 보증금 반환 보증 보험 에 가입 하다 때 는 제출 서류 중 하나 가 확정 일자 확인 이 되다 공인 중개사 날인 이 찍히다 계약서 사본 을 요구 하다 참고 하다 네 그렇다 우리 계약 은 낙성 불 요 식 이다 청약 과 승낙 이 있다 되다 특정하다 요 식 에 의하다 않다 명시 계약 이나 묵시 계약 으로도 계약 의 성립 되다 것 을 의미 하다 빈 용지 에 임의 양식 으로 만들다 계약 하다 되다
안녕하다 현재 는 부동산 트렌드 가 선분 양 이 잖다 근데 최근 건설 사태 이후 후분 양 을 하다 것 아니다 여론 이 강하다 있다 상황 인데 만약 에 부동산 청약 트렌드 가 후분 양 이 되다 어떻다 파급 효과 가 있다,선분 양 이 트렌드 라서 그렇다 아니다 건설 자금 및 분양 가 등 으로 우리나라 에서 선분 양 이 정착 하다 되다 것 이다 선분 양 은 후분 양 에 비다 장점 은 건축 후 시 세 반영 이 오다 되다 않다 분양 가가 낮다 편입 니 다 즉 후분 양 으로 전환 하다 되다 건설 살다 건설 자금 을 모두 확보 하다 건설 을 진행 하다 때문 에 중소 형 건설 살다 사실 상 건축 이 어렵다 지다 있다 단점 이 있다 반면 분양 자 입장 에서는 분양 계약 시 실물 을 보고 계약 을 하다 있다 입 주가 빠르다 장점 이 있다 다만 분양 가가 건축 후 지다 상승 분 까지 포함 되다 때문 에 분양 가가 높다 사실 상 로또 분 양 등 은 사라지다 가능성 이 높다
입지 관련 하다 알아보다 허프 의 이론 이 있다 이 이론 이 무엇 인가요 입지 를 선정 하다 때 허프 의 이론 이 어떻다 사용 되다 궁금하다,간단하다 설명 하다 허프 의 확률 모형 은 점포 매출 애 과 상권 의 크기 를 확률 적 모형 으로 설명 한 이론 으로 가장 중요하다 것 은 마찰계수 이며 이다 교통 편이 열 악 하다 커지다 되다 예 로 상권 이 전 문 품명 품 자동차 의 경우 마찰계수 는 작아지다 되다 이다 곧 멀다 곳 에서도 구매 하다 오다 것 이다
부동산 개발 에 관심 이 많다 부동산 개발 시 에 들어가다 비용 들 에 대해 서 많이 궁금하다 대략 적 으로 설명 하다 주다 좋다 세다 설명 해주다 좋다 알다 감사하다,부동산 개발 이라는 게 단순하다 토지 를 형질 변경 을 하다 것 일수 있다 나대다 건축 을 하다 행위 일 수도 있다 각 개발 에 따르다 비용 이나 과정 절차 등 이 모두 다르다 포괄 적 으로 설명 드리다 기다 어렵다
서울 에서 주택 을 구입 하다 하다 부동산 가격 이 너무 비싸다 부동산 가격 이 계속 오르다 이유 는 무엇 인가요 특히 서울 에서 부동산 가격 이 계속 오르다 이유 는 무엇 인가요,부동산 가격 이 오르다 여러가지 요인 이 있다 수 있다 시장경제 에 따르다 수요 가 증가 하 거나 공급 이 감소 되다 경우 가격 이 상승 하다 되다 수요 와 공급 은 각각 다른 요인 에 따르다 변동 되게 되다 단순 설명 은 어렵다 단 우리나라 의 경우 부동산 시장 은 수도권 과 서울 을 중심 으로 반응 을 보이다 떄문 에 가격 이 상승 하다 경우 서울 이 먼저 움직이다 되다 그 폭 역시 크게 되다 또한 주변 환경 학군 등 입지 를 고려 하다 때 도 서울 중심 으로 흘러가다 떄문 에 수요 가 많다 이롭다 가격 반응 도 빠르다 되다
중국 경제 붕괴 의 트리 거가 부동산 문제 라고 말다 들다 경제 의 한 부분 일 뿐이다 분야 의 문제 로 전체 경제 가 흔들리다 말 하다 맞다 우리나라 역시 부동산 문제 에 대해 나라 가 적극 적 으로 대출 한도 제한 풀다 세 제 혜택 에 심지어 나라 가 분양 안되다 걸 사주다 보다 부동산 에서의 문제 를 심각하다 받아들이다 같다 부도 나 늘다 회사 가 매년 생겨나다 그저 일반 회사 부다 건설 회사 부다 미분 양 좀 쌓이다 그런 걸 나라 가 걱정 하다 하다 일 인가요,부동산 의 경우 상대 적 으로 산업 에 종사 하다 인구 가 많다 또한 건설 금융 철강 등 다른 산업 과의 연관 성 이 높다 부동산 경기 가 안좋다 것 은 전체 적 인 국가 경제 성장 에 부정 적 인 요소 로 작용 하다
부동산 중개업 소 를 창업 하다 법인 개인 등 보증금 이 필요하다 하다 얼마나 필요하다 궁금하다 최근 에 금액 이 바뀌다 들다,부동산 중개업 소 를 창업 하다 공인 중개사 자격증 개설 등록 사업자 등록 을 하다 중개 행위 를 하다 수 있다 개설 등록 접수 하 면 억원 까지 보증 하다 보증 보험 에 가입 하다 개설 등록 허가증 이 발급 되다 보증 보험 가입 을 하다 않다 개설 등록 이 불가 이다
부동산 매물 이 증가 하다 되다 지금 과 같다 상황 에서는 거래 가 많아지다 않다 듯 한데 이렇게 되다 경우 다시 하락 하다 가능성 이 매우 높다 보이다 괜찮다 끄다,투자 수요 가 없다 실수 요 자의 거래량 이 대부분 이다 만큼 일시 적 반등 이라고 보다 시점 이 많다 급매 물들다 실수 요 자 에 의하다 대부분 소진 이 되어다 이 과정 에서 반등 이 있다 것 으로 보이다 반등 의 신호 로 보고 매 도인 들 은 호가 를 높이다 시작 하다 거래량 이 동반 되다 않다 일부 의 거래 로 오르다 주장 하다 있다 실수 요 자 나 투자 수요 자 들 은 역전 세 및 경 기 침체 의 원인 으로 좀 더 기다리다 보다 당분간 은 관망 세 가 대세 인 듯 합 니 다년 말 년 초 역다 문제 가 해소 되다 시점 까지는 이 관망 세 가 유지 되다 보다 더불다 금리인하 의 신호 가 나오다 급등 은 아니다 더 라고 꾸준하다 우상 향 하다 오르다 시작 이 되다 있다 보다
대 초반 의 남성 이다 저희 집 에 만평 임야 가 있다 공시지가 로 억 정도 되다 만원 에 구입 하다 년 쯤 지나다 부동산 상속세 를 줄이다 수 있다 방법 이 없다 부분 상속 도 가능하다 요,개인 이 부동산 등 을 취득 한 이후 향후 에 소유자 의 상속 개시 에 따르다 피상 속인 의 재산 채무 가 상속 이 되다 경우 상속인 은 피상 속인 의 상속 개 시일 로부터 개월 이 되다 날 이 속 하다 달 의 말일 까지 피상 속인 의 주소지 관할 세무서 에 상속세 신고 납부 를 하다 하다 상속 재산 중 부동산 이 과 다한 경우 상속 개시 년 이전 에 미리 상속인 등 에게 지 분 으로 증여 하 거나 또는 일부 지 분 을 양도 하다 것 도 고려 하다 보아 야 하다 피상 속인 의 상속 재산 가액 을 줄이다 것 이 상속세 절세 에 도움 이 되다
현재 자산 상태 는 인천 지역 재개발 조합원 입 주권 개 조만간 이주 완료 예정 시세 대략 억천이 상 추정 무 이자 이 주비 대출 천 향후 완공 시 이다 하다 예정 입 주시 약 억 천 정도 추가 로 필요하다 년년경 완공 되다 한데 아직 이주 완료 전이 라 확실 치다 않다 인천 지역 재개발 조합원 입 주권 개 올해 말 이다 예정 이며 입 주시 약 천정 도 필요하다 시세 는 약 억천이 상 추정 인천 지역 신축 아파트 단지 내 상가 분양 올해 월경 잔금 예정 이며 분양 가 억 천 잔금 시 약 천정 도 필요 아직 월세 는 맞추다 못 하다 대략 만 정도 가 시세 인 듯 하다 현재 전 재산 이 부동산 에 묶이다 부동산 이라 정확하다 않다 상가 는 분양 가로 하고 나머지 는 현 시세 대로 하다 때 대충 순 자산 억 전후 인 듯 하다 올해 말 쯤 아파트 이다 상가 잔금 때문 에 억억 천 정도 의 대출 이 필요하다 같다 물론 상가 월세 보증금 을 받다 대출 을 덜 받다 되다 아직 월세 세 입자 를 구 하다 못 하다 배제 하다 이런 상황 에서 올해 말 에 번 아파트 에 이다 하다 향후 번 아파트 가 완공 돼다 때 이다 하다 부동산 자산 을 어떤 식 으로 가지 고 가야 하다 조 언 구합 니 다,부동산 이라는 범주 아래 각기 다른 기 대 효용 이 존재 하다 소득 수익 자본 수익 위험 분산 절세 소유 에 따르다 만족감 등 본인 의 재무 목표 에 따르다 관리 하다 되다 번은 같다 재무 목표 인 거주 주택 이기 에 향후 다른 방향 으로 활용 하다 처분 한 다 거나 고려 해보다 되다 오히려 지금 문제 는 무엇 이 문제 인지 모르다 상황 인데 자산 관리 에 대한 위험관리 가 안되다 있다 자산 비중 의 대부분 이 실물 부동산 인 경우 거의 모든 자산 이 같다 위험 에 노출 되어다 있다 오히려 투자 위험관리 가 반드시 필요하다
조건 은 아래 와 같이 가정 하다 소유 부동산 이 채 이고 연금 을 만원 을 받다 있다 하다 소유 부동산 을 만원 월세 를 보증금 억 에 놓다 상태 이고 은행 에서 대출 을 받다 금액 이 억이 있다 가정 하다 개인 사업 도 소득 이 만원 초과 하다 경우 이 에 대한 세금 을 내다 안내 고가 있다 들다 조건 과 같이 소득 이 생기다 연금 까지 포함 하다 때 만원 이 넘다 거 같다 경우 월세 를 내 놓다 임대 인 은 사업자 등록 을 하다 것 이 나다 끄다 갖다 있다 집 채 로 사업자 등록 을 하다 경우 와 사업자 등록 을 하다 않다 경우 어떻다 다르다 궁금하다,주택 자 가 임대 를 내놓다 경우 는 사업자 등록 을 하다 이유 가 크게 없다 다 주택 자 들이다 임대 사업자 를 하다 면 정부 하다 택 이나 주택 수 에 포함 되다 않다 등 좋다 점 이 많다
부동산 임대 또는 거주 용 으로 알아보다 보다 지하철 역다 권 이라는 표현 을 많이 보다 되다 여기 서 말 하다 지하철 역다 권 은 지하철 과 가깝다 뜻 인거 같다 그렇다 통상 차량 기준 인가요 아니다 도보 기준 인가요 지하철 역다 권 은 어느 정도 시간 이 걸리다 것 까지 역다 권 이라 하다 수 있다 가요,역다 권 이라는 것 은 도보 로 분 에서 분 거리 를 말 하다 아무래도 지하철역 과 가깝다 생활 하다 편리하다 보다
안녕하다 부동산 매매 하다 예정 이다 아파트 매 매가 는 조정 이 어렵다 복비 를 협의 하다 하다 매 매가 억 아파트 의 경우 중개 수수료 만 부가세 합치다 만원 이라고 하다 현금영수증 안 하다 조건 으로 만원 에 해주다 부동산 입장 에서 현금영수증 은 의무 발행 아니다 현금영수증 안 하고 만원 에 하다 어떻다 말 을 하다 현금영수증 을 받다 좋다 전문가 님 의 견해 부탁드리다 감사하다,일반 적 으로 중개 보수 도 현금영수증 발행 의무 가 있다 다만 중개 부동산 이 일반 과 세다 부가가치세 을 별도 로 지급 을 요구 하다 경우 가 많다 질문 처럼 하다 싶다 사실 상 중개사 와 협의 를 거치다 진행 하다 되다 부분 으로 보이다
근저당 설정 으로 담보 대출 사용 중 인 부동산 을 채권자 합의 하 에 판매 하다 하다 근저당 이 안 잡히다 정상 판매 시보 다 시 세차 익 이 월등하다 낮아지다 요,이다 물건 에 따르다 다르다 때문 에 단순하다 위 질문 으로는 시세 가 낮아지다 등 을 답변 드릴 수 없다
