질문,답변
아파트 를 매도 하다 때 집 앞 에 부동산 에만 얘기 를 하다 동네 부동산 에 전부 다 얘기 를 하다 고민 인데 요 집 매도 하다 때 부동산 거래 팁 알다,최소 군데 가보다 정확하다 가격 이나 오다
제 꿈 이 부동산 을 운영 하다 매매 도 열심히 해드리다 돈 도 많이 벌 고 싶다 살 이다 부동산 시 작시 들어가다 비용 을 마련 햇 늘다 어리다 차별 이 다른 곳 과 잇다 그렇다 않다 부동산 운영 꿀팁 알다 팁 도 부탁드리다 ㅠㅠ,부동산 을 운영 하고 돈 을 버 는 것 은 나이 와는 전혀 상관 이 없다 하다 일단 부동산 을 운영 하다 함 은 먼저 공인 중개사 자격증 을 취득 하다
사정 이 좋다 않다 지금 매다 없다 집 을 파다 ㅜㅜ 근처 부동산 에는 전화 돌리다 보다 달 간 놀다 하다 급매 가 말 도 안되다 가격 에 나오다 거래 가 안되다 ㅜㅜ 저희 도 급매 로만 내놓다 야하다 건지다 ㅜㅜ 매매 잘 되다 꿀팁좀 줄다 근처 부동산 은 무조건 거래 가 안되다 만하 고집 근처 말고 근처 동네 에 매물 을 내놓다 좋다 머리 가 아프다 ㅜㅜ,일단 동네 부동산 에 최대한 많이 내놓다 가격 을 아깝다 최대한 낮추다 부동산 에 집 내놓다 때 집 내부 사진 도 깨끗하다 넓다 나오다 찍다 보내다 네이버 부동산 에 올리다 있다
곧 계약 이 다 되다 월세 방 을 구해 야하다 이 집 구 하다 때 도 부동산 사람 이 의도 적 으로 안좋다 집 을 자꾸 소개 시키다 다르다 가도 거의 그렇다 식이 던데 어떻다 하다 하다 요,여러 군데 공인 중개사 를 통해 다양하다 매물 을 확인 후 결정 해보다 방법 이다 다각 공인 중개사 에 나오다 있다 매물 차이 가 있다 한 곳 을 가보다 마음 에 들다 월세 방이 없다 달다 공인 중개사 사무소 를 통해 다른 물건 을 소개 받다 보다
반려견 이 마리 있다 부동산 을 하루 에 곳도 가보다 하나같이 집 이 없다 또는 집주인 이 개다 안되다 뎄 다 하다 전부 퇴짜 네 요 반려견 있다 분 이나 부동산 분들 집다 꿀팁 없다 요즘 집값 이 비싸다 나오다 매물도 월세 없다 하다 더 힘드다 ㅠㅠ 어플 보고 연락 하다 퇴짜 답답하다 질문 남기다 보다,안타깝다 집주인 이 반려견 을 허락 하다 계약 이 되다 집주인 에게 반려견 을 키우다 중 훼손 하다 것 에 원상 복구 를 하다 설득 하다 되다 이웃 중 에 반려견 소리 를 싫어하다 사람 이 있다 경우 이웃 과 갈등 이 발생 하다 수 있다 크다 고로 도 이어지다 수 있다 때문 에 집주인 은 안되다 하다
월세 살다 월세 나가다 아깝다 전 세 자금 을 마련 하다 위해 저축 을 차곡차곡 쌓다 있다 메스 컴 을 통해 서 보다 전 세 사기 가 비일 기재 하다 보다 희망 감 이 회의 감 으로 느껴지다 요즘 인데 요 그렇다고 평생 을 월세 내가면 서 살수 도 없다 노릇 이고 내집마련 때 까지는 전세 를 거치다 전 세 사기 를 당하다 않다 방법 및 팁좀 주시 죠 올바르다 부동산 전문가 님 들다,전세계 약시 특약 에 문제 발생 시 중개사 가 일부분 이라도 보상 한 다 라고 적다 중개사 가 그나마 안전하다 매물 을 추천 하다 않다 싶다
부동산 경매 를 시작 하다 하다 회사원 이다 시작 하다 하니 두려움 이 눈앞 을 가리다 전문가 님 은 처음 시작 하다 때 어떻다 마음 이다 그리고 경매 를 하다 제일 힘들다 일 마지막 으로 추천 해주다 한 책,부동산경매 를 자다 하다 있다 방법 은 손품 발품 머리 품 품 을 팔 아야 하다 먼저 공부 를 하다 하다 이론 부터 실무 까지 공부 를 하다 하다 그리고 물건 을 찾다 현장 답사 즉 임 장 활동 을 꾸준하다 하다 하다 그리고 꾸준하다 입찰 에 참여 도 하다 하다 그리고 낙찰 을 받다 매도 까지 여러 번 해보다 하다 그러면 차츰차츰 실력 이 향상 이 되다 전문가 가 되어다 가다
제 가 이번 에 부동산 자격증 시험 을 준비 하다 교재 랑 모의고사 문 제 집 을 사려 니깐 가격 이 좀 나가다 강 의료 도 비싸다 책 이라도 좀 저렴하다 구매 하고 싶다 좋다 팁 이 있다,인터넷 서점 에서 구매 하다 때 중고 를 살 수 있다 조금 저렴하다 가격 에 판매 하다 것 같다
종합소득세 가 너무 많이 나오다 절세 하다 팁좀 알다 연매출 억 정도 되다 회 사다 전 년도 종합소득세 가 천만원 이상 나오다 소득세 절세 방안 중 부동산 츄 ㅣ 득 으로 효과 를 볼 방법 이 있다 문의 드리다,사업 용 부동산 을 취득 하다 사업 용 부동산 과 관련 되다 대출 이 자비 용이 있다 해당 이자 비용 은 사업 소득 경비 로 공제 가 가능하다 또한 사업 용 부동산 은 매년 감가상각비 로 비용 처리 가 가능하다
안녕하다 이번 에 부동산 매수 하다 곧 잔금 예정 인 사람 이다 은행 대출 이 있다 은행 에서 연결하다 법무사 님 에게 견적 을 받다 이 경우 예상 하다 금액 보다 금액 이 크다 경우 어떻다 방법 으로 가격 조율 을 하다 하다 요,어플 을 이용 하다 서비스 를 받다 것 더 나아 보이다 대면 상담시 가격 협상 의 어려움 이 있다 성실하다 도와주다 않다 가능성 도 있다 보이다
안녕하다 오피스텔 월세 로 원룸 을 구 하다 있다 중개 수수료 를 절약 하다 있다 꿀팁 있다 신분 들 의 조언 을 좀 구 하고 싶다 글 남기다,원룸 투룸 미니 투룸 등 의 방 들 을 직접 보고 옵션 을 확인 하고 보증금 과 월세 관리 비 와 공과금 부담 금 주 차비 기타 사항 등 을 확인 하고 쌍방 합의 로 임대차 를 계약 하다 그러면 복비 를 들이다 않다 방 을 구 하고 주인 과 직접 계약 하다 방식 이 흔하다 성행 하고 있다 정말 착하다 임대 인 합리 적 이고 공정하다 임대 인도 많이 있다 것 은 사실 이다 그러나 저 는 공인 중개사 라서 가 아니다 그냥 일반 적 인 관점 에서 보아 이렇다 주인 직접 거래 방식 을 결코 권유 드리다 싶다 않다 중개 수수료 를 물다 등록 되다 공인 중개사 를 통해 서 권리 관계 깡통 전세 우려 배제 하자 발생 항목 발생 시 의 대응 확정 일자 등 임대차 필수 기 본 사항 을 철저하다 첵크해 서 책임 중개 안전 거래 하다 기르다 추천 드리다
부동산 가격 이 많이 내리다 그래서 부동산 에 투자 해보다 하다 무엇 부터 공부 하다 하다 요 초보 투자자 인데 좋다 팁 을 알다 부탁드리다,부동산 투자가 그저 이론 만으로 안되다 또 실전 을 많이 하다 다 성공하다 것 도 아니다 것 같다 무엇 을 공부 하다 것 보다는 일단 가장 먼저 시드머니 가 있다 그 다음 에는 현 장임 장 입지 분석 권리분석 투자 결정 으로 이어지다 여기 에 어떻다 왕도 는 없다 같다 기본 에 충실하다 하다 부동산 경 기 리듬 을 자다 타다 하다
안녕하다 최근 재태크 열풍 에 편승 하다 부동산 주식 등 재태크 열공 및 공 모주 참여 등 다양하다 투자 를 병행 하고 있다 최근 고민 이 회사 일이 바쁘다 집중 하고 야근 하다 재태크 에는 소홀하다 되어다 공 모 주 청약 및 직접 주식 투자 이벤트 나 이슈 에 자다 대응 못 하다 되다 좋다 팁 없다,투자 라는 것 은 대체로 미래 에 내 가 가지 고 있다 자산 이 증가 하다 것 을 가정 하고 하다 것 이다 사람 마다 기대하다 목표 치 기간 이 다르다 텐데 제테크 시장 에서는 아무리 못 해도 최소 년 이상 이다
아직 학생 신분 인데 졸업 후 에 부동산 설계 를 어떻다 하다 하다 요 처음 시작 으로 무엇 이 중요하다 공부 는 어떤 방향 으로 하다 하다 요 혹시 답장 하다 분 께서 팁 도 알다 감사하다,부동산 에 대하 여 항상 관심 을 갖다 있다 되다 경 제 신문 을 항상 구독 하다 부동산 동향 에 대해 서 예의 주시 하 면 더욱 좋다 것 같다 언제나 관심 을 가지 고 기회 를 엿보다 자 에게 기회 가 다가오다 청약 저축 은 기본 으로 가입 하다 분양 공고 에 대해 서도 유심 히 보시 면 기회 가 있다 거 예요
저축 과 투자 를 놓다 고민 중 인 사회 초년 생 이다 저축 을 하다 있다 하지만 투자 도 병행 하다 좋다 어떻다 투자 주식 부동산 등 가 좋다 궁금하다,사회 초년 생 이 시 라면 돈 의 사용 용도 와 기한 이 있다 것 이다 주식 채권 금 예금 코인 등 여러가지 자산 에 대한 자산 배분 을 공부 도 해보다 부동산 청약 같다 것 도 염두 하다 두시 고 청약 저축 에 가입 도 하다 바라다 투자 는 소액 으로 꾸준하다 평생 하다 습관 을 가다 것 이 좋다
자산 투자 로 토지 에 투자 를 해보다 하다 자다 알다 자문 을 얻다 하다 법적 으로 꼭알 고 구매 하다 되다 법적 자문 이나 법률상 식 을 알다 신분 은 좋다 팁 을 알다,일반 적 인 기본 적 인 사항 으로는 토지 등기부 등본 을 통 하다 가압류 가등기 여부 와 소유권 관계 를 확인 하다 구 에 근저당 채권 최고 액 을 확인 하고 매매 잔금 시 까지 말 소 해지 를 확인 하다 계약 을 체결 하다 전 에 주변 거래 사례 를 통해 시세 를 확인 비교 분석 하고 임 장 을 통해 수목 과 기타 지장 물의 포함 여부 점유 자 의 여부 경 사도 나 향후 개발 가치 등 을 분석 하다 매매 시 는 반드시 소유자 본인 과 대면 계약 하다 가능하다 토지 전문 부동산 공인 중개사 를 통 하다 거래 하다 보다 안전하다 신뢰 하다 수 있다
제목 그대로 이다 부동산 소개 소 통해 서 짜다 오피스텔 월세 로 임대 하다 소 개비 는 얼마나 되다 그리고 사후 챙기다 야하다 서류 나 기타 팁좀 가르치다 줄다 확정 일자 등등 미리 감사 드리다,우선 보증금 만원 에 만원 월세 의 오피스텔 이 라면 주거 용이 아니다 경우 환상 보증금 은 만원 이 되다 여기 에 중개 요 율 적용 시 만원 이 나오다 되다 그리고 계약 시 별도 의 서류 는 부동산 에 챙기다 되다 그 부분 만 확인 하다 되다 해당 목적 물 을 인도 받다 뒤 에는 해당 주소 로 사업자 등록증 신고 와 세무서 를 통해 확정 일자 를 부여 받다 되다 만약 용도 가 주거 용이 며 실제 주 거목 적 이 라면 중개 보수 는 만원 을 넘다 않다 되다 전입 후 에는 전입 신고 와 확정 일자 를 주민 센터 에서 신고 및 부여 받다 되다
요즘 고 금리 시대 에 부동산 대출 이율 이 높다 하다 혼인신고 를 하다 나라 에서 하다 대출받다 어리다 것 같다 혼인신고 전 에 집 을 계약 하다 맞다 혼인 신고 전 에 꼭 하다 좋다 팁 알다 감사하다 참고 로 전 지방 에 거주 하다 충청권,사실 금리 나 임대차 조건 이 좋다 공공 관련 부분 은 단독 세 대 일 때 보다 신혼부부 등 에 적용 되다 경우 가 더 많다 때문 에 꼭 결혼 전 에 무엇 을 준비 하다 하다 하다 않다 보이다 그리고 혼인신고 를 하다 하다 대출 한 도나 승인 이 더 어렵다 하다 않다
현재 우리나라 의 상속 세율 이 최대 인데 이제 는 서울 에 아파트 하다 채 만 갖다 있다 상속세 를 위해 보유 한 아파트 를 팔 아야 하다 상황 이다 이 에 부동산 을 보유 한 사람 들 을 위해 미리 상속세 를 절감 하다 수 있다 유용하다 팁 좀 부탁드리다,상속세 와 증여세 의 세율 은 동일하다 상속세 의 공제 가 훨씬 크다 상속인 으로 자녀 가 있다 기본 으로 억 을 공제 해주다 자녀 배우자 가 있다 억 억 까지 공제 가 가능하다 이 에 반하다 증여 재산 공제 는 수 증자 가 자녀 일 경우 년 간 천만원 공제 가 되다 수 증자 가 배우자 일 경우 억 원 이 공제 되다 따라서 일반 적 으로는 상속 이 증여 보다 유리하다 상속 재산 이 상속 공 제 액 을 초과 하다 납부 하다 상속세 가 많다 사 전 증여 를 통해 서 상속세 를 줄이다 것 이 중요하다 상속 일 전 년 이내 상속인 에게 증여 한 재산 은 상속 재산 에 다시 가산 하다 상속세 를 계산 하다 때문 에 의미 가 없다 수 있다 최소 사망 예정일 년 이전 부터 사전 증여 계획 을 수립 하다 상속인 들 에게 사 전 증여 를 하다 것 이 중요하다 도움 이 되다 바라다
안녕하다 에 계약 만료 이다 묵시 적 갱신 으로 자동 연장 하다 하다 그냥 방 빼다 일 에 통보 드리다 집주인 은 우선 부동산 에 방 올리다 방 빠지다 계약금 을 돌려주다 하다 안 빠지다 경우 일 에는 무조건 주다 하다 좀 빨리 돌리다 받다 수 있다 팁 없다 여,묵시 적 갱신 이후 임차 인 의 계약해지 요 구시 임대 인 은 통보 받다 뒤 개월 후 계약 은 종료 되다 현 상황 으로 진행 되다 것 이 맞다 보이다 보증금 을 이보 다 빨리 받다 위 하다 다음 임차 인 을 빠르다 구 하다 방법 외 에는 없다 듯 보이다
본인 의 집 을 구 하다 것 은 더욱 어렵다 지다 비싸다 그렇다 주거 를 위 한 내 집 마련 을 하다 때 고려 하다 사항 과 입지 가 좋다 곳 이 어떻다 곳 을 말 하다 저 평가 가 돼다 라고 판단 하다 수 있다 근거 팁를 알다 감사하다 ㅠ,좋다 입지 의 요건 은 보통 학군 교통 접근성 자연 친 화 숲강 등 을 말 하다 수도권 의 경우 지하철역 이 몇 호선 을 지나다 역 까지는 얼마나 가깝다 중요하다 요소 이다 학군 과 자연 의 근접 성 또한 매우 중요하다 요소 이다
깡통 전세 사기 전세 이야기 가 많이 나오다 부동산 시장 이 얼어붙다 부동산 투자 를 지금 사람 들 이 안 하다 때 하다 맞다 생각 이 듭니 다 그즌 ㅇ 에도 경 매 시장 에 관심 이 많다 알다 많이 없다 선뜻 다가가다 힘드다 부동산경매 를 하다 때 주의 하다 하다 사항 및 어떤 부분 을 보고 경매 를 참여 하다 중 팁 이 있다 공유 부탁드리다,아무래도 경매 는 가격 이 죠 말 소 기준 권리 파악 을 잘 하다 임 장 은 필수 이다 권리 사 항만 보고 임 장 안 가다 유치권 이라도 있다 낭패 이다 진성 인지 확인 도 잘 하다 아니다 유치권 이 있다 안건 들이다 좋다 빚 을 지고 타의 로 경매 가 나오다 만큼 명도 하다 보통 일이 아니다
안녕하다 저 의 부모님 은 작다 상가 를 가지 고 계시다 얼마 전 부가가치세 신고 를 하다 하니 세금 이 약 만원 나오다 간이 과세 자다 건물 보증금 만원 에 월세 는 만원 정도 받다 세금 을 절세 하다 방법 이 궁금하다 제 가 직접 신고 를 하다 중간 중간 에 공제 라는 부분 이 있다 어떻다 부분 을 넣다 하다 애매하다 공란 으로 비우다 원 정도 세금 이 나오다 작다 팁 이라도 알다 감사하다,부동산 임대 업 의 경우 일단 관련 비용 을 빠뜨리다 말고 챙기다 반영 하다 하다 것 이다 일반 적 으로 인건비 접 대비 엘리베이터 등 건물 에 대한 수 선비 재산세 와 종합 부동산 세 관련 대출 에 대한 이자 비용 감가상각비 소모품 비등 이 부동산 임대 업 의 필요 경비 에 해당 하다 또한 적용 가능하다 소득 세액 공제 를 챙기다 좋다 노랗다 우산 공제 연금 저축 세액 공 제등 은 사업자 소득 세액 공제 가 가능하다 때문 에 이 부분 도 가입 가능하다 세액 절감 이 가능하다
안녕하다 지인 의 부탁 으로 문의 드리다 위해 글 을 올리다 되어다 만약 채 의 집 을 가지 고 있다 년 취득 년 실 거주 매매 가 억 빌라 년 취득 년 실 거주 매매 가 억 아파트 인 경우 주택 을 팔다 순서 가 양 도세 에 영향 을 주다 되다 궁금하다 만약 영향 을 주다 어느 것 을 먼저 팔다 것 이 좋다 참고 로 위 의 정보 이외 에 추가 로 양 도세 를 절세 하다 있다 팁 이나 정보 가 필요하다 것 이 있다 댓글 부탁 드리다 그리고 위 의 주택 을 취득 하다 내다 인테리어 비용 취득세 은행 이자 법무사 비용 부동산 비용 등 은 양도 세차 익 에서 공제 가 가능하다 것 인지 요 가능하다 어떻다 증빙 이 필요하다 감사하다,위 의 정보 외 에도 해당 자산 의 양도 차익 이 어느 정도 까지 발생 하다 수 있다 두 주택 이 조정 대상 지역 에 위치 하다 지다 에 따르다 그 세율 과 세액 이 크게 차이나다 위 정보 만으로는 판단 이 불가능하다 다만 두 번째 주택 을 취득 한 날 이 상당하다 오래 돼다 때문 에 일시 적 세대 주택 비 과세 규정 은 적용 받다 힘들다 위 의 사안 에서도 두 주택 의 위치 가 조정 대상 지역 이 모두 아니다 양도 차익 이 가장 적다 나 는 주택 부터 양도 하다 양도소득세 를 최소 화하다 양도소득세 가 크게 발생 하다 주택 을 세대 주택 비 과세 규정 을 적용 받다 양도 하다 것 이 유리하다 것 이다 위 의 주택 취득 비용 중 에서도 내부 실내 인테리어 비용 은 인정받다 쉬다 않다 취득세 법무사 비용 중개 비용 은 취득 가액 에 가산 하다 수 있다 다만 이 자비 용의 경우 에는 취득 과 관련 없이 보유 에 따르다 지출 이 므 로 비용 인정받다 못 하다 증빙 으로는 세금 계산서 현금영수증 기타 증빙 가능하다 명세서 와 출금 내 역 이 있다
이제 곧 이사 갈다 예정 인데 집 자다 고르다 법 좀 알다 부동산 분과 보증금 이나 월세 낮추다 자신 만의 꿀팁 도 부탁드리다 맨날 계약 하다 보다 월세 에 가다 붙다 관리 비,집주인 마다 개인 시정 이 있다 월세 를 낮추다 달라 고 부탁 학 고 대신 에 보중 금 을 조금 올리다 하나 의 방법 이라 생각 하다
제 가 이번 에 소형 오피스텔 매매 를 하다 하다 부동산 매매 가 처음 이라 잘 모르다 오피스텔 매매 하다 때 주의 하다 점 이나 좋다 오피스텔 매매 하다 있다 꿀팁 이 있다,오피스텔 을 매수 하다 가급적 급 매물 위주 로 매수 를 하다 것 이 적절하다 보이다 또한 해당 오피스텔 주변 상권 이 형성 되어다 있다 등 을 종합 적 으로 검토 가 필요하다 보이다 검토 사항 으로 주변 상권 브랜드 명 가격 적 인 측면 등 을 고려 하다 하다
얼마 전 방송 기사 를 보다 부동산 업체 를 통해 전세계약 을 하다 불구 하고 다가 구 소유자 에게 사기 를 당하다 고통 받다 분 들 이 많다 초보 도 꼭 집 과 넘어가다 하다 꿀팁 알다,전 세 사기 는 대체로 두 가지 형태 이다 유주 나 권리 를 변동 시키다 대놓고 사기 를 치자 고 마음 먹다 유형 과 불가피하다 부동산 경기 가 안좋다 전세 가보다 매매 가가 낮아지다 역다 되어다 보증금 을 돌려주다 수 없다 형태 가 있다 전자 는 소 유주 확인 을 자다 하다 전입 당일 까지 소유 주 변경 이나 근저당 등 의 등기 상 권리 변동 이 없다 대한 특약 정도 를 쓰시 면 일이 터지다 대처 는 가능하다 후자 는 일명 깡통 전 세로 가급적 이면 매 매가 에 근접하다 전세 는 계약 하다 말다 보증 보험 에 가입 가능하다 집 을 위주 로 계약 하다 좋다 물론 위 의 내용 들 을 따다 보다 계약 집 이 현저 히 적어지다 문제 도 있다 적어도 전 세 사기 는 어느 정도 예방 가능하다 또한 부동산 을 통해 서 집 을 알아보다 때 는 광고 를 보고 집 을 보다 갈다 그 지역 주변 부동산 을 이용 하다 좋다
처음 매도 하다 보다 모르다 부동산 에 올리다 기다리다 뭘 준비 하다 하다 요 그리고 집 잘나가다 하다 팁 이 있다,물건 주변 공인 중개사 에게 물건 을 내놓다 기다리다 방법 이 일반 적 이다 장 빠르다 매도 하다 위 하다 가격 적 인 측면 실내 인테리어 및 정리정돈 상태 이다 하다 사람 의 눈 은 비슷하다 보기 좋다 깨끗하다 인테리어 가 자다 되어다 있다 아무래도 관심 이 높다 지기 때문 이다
최근 부동산 에 관심 이 많다 매매 또는 전세 물건 을 많이 보다 되다 이사 갈다 때 가 되어다 ㅠㅠ 근데 동일 아파트 단지 인데 가격 이 천 차 만 별 이 던데 명당 을 고르다 팁 은 무엇 이다 요 막상 살 아보 면 왜 그렇다 조금 은 알다 같다 살 아 보지 않다 고르다 있다 방법 또는 부동산 에 방문 시 명당 을 추천 받다 있다 팁 이 있다 알다 줄다,동 호수 에 따르다 가격 이 차이나다 것 은 여러가지 이유 가 있다 같다 아파트 이지만 평수 차이 교통 주변 상권 일조권 보장 등 으로 가격 차이 가 발생 하다 수 있다 명당 이라고 말 하다 것 까지는 아니다 일조권 이 자다 보장 되다 교통 접근성 이 좋다 곳 을 찾다 것 이 좋다
평범하다 직장인 으로서 알맞다 제테크 는 어떤 것 을 추천 받다 수 있다 주식 부동산 등 우리 가 일상 적 으로 알다 분야 이외 에 대한 팁 이 있다 소개 받다,요즘 은 재테크 를 하다 매우 어렵다 환경 이다 따르다 가능하다 예금 이나 적금 위주 로 예 테크 를 하다 분 들 이 많다 것 으로 알 고 있다 혹은 주식 에 대하 여 조예 가 깊다 분할 매수 로 추후 상승 장 을 기다리다 혹은 인 버스 상품 을 통 하다 수익 을 보다 수 있다
저축 을 위해 어떻다 방식 으로 돈 을 절약 하다 수 있다 알 고 싶다 생활비 절감 지출 관리 부동산 주식 등 의 투자 방법 등 절약 과 관련 되다 다양하다 팁 과 전략 에 대해 조언 부탁드리다,돈 을 절약 하다 가장 좋다 방법 은 지출 을 통제 하다 방법 부터 시작 한 다 고 하다 이 지출 을 통제 하다 위 하다 내 가 어떻다 항목 에 돈 을 지출 하고 있다 확인 하다 하다 때문 에 가계부 를 따로 작성 하다 혹은 가계부 어플 을 사용 해주다 것 이 좋다 이렇게 사용 하다 지 출처 를 확인 하다 되다 변동 비용 고정 비용 으로 분류 를 해주시 고 나머지 자금 은 모두 저축 자금 으로 돌려주다 것 이 좋다 고정 비용 은 더 이상 비용 을 줄이다 힘들다 비용 이기 때문 에 변동 비용 의 세 부항 목 을 보시 고 비용 을 줄 이실 수 있다 것 을 확인 해주다 하다 그리고 이렇게 비목 을 나누다 되어다 각 비목 별로 통장 을 따로 개설 하다 관리 를 해주시 는 것 이 좋다 월급 통장 변동 지출 통장 고정 지출 통장 저축 이렇게 자리 로 분류 를 해주시 고 월급 이 입금 되다 변동 비 와 고 정비 통장 으로 입금 을 해주다 이렇다 통장 들 은 파킹 통장 을 이용 하다 것 이 효율 적 이다
거주 중 인 아파트 매매 하고 집 을 비우다 야하다 전 세로 년 있다 예정 인데 계약 때 주의 하다 하다 점 또는 이런 집 은 피해 라 꿀팁 있다 알다 요즘 부동산 하락 으로 깡통 전 세도 많다 하다 보증 보험 가입 도 어렵다 보이다 사항 및 피해 야하다 집 있다 지식 기부 부탁드리다,요즘 깡통 전세 등 전 세 사기 가 기승 을 부리고 있다 전세 사기 를 최소 화 하다 위 하다 아래 항목 을 꼼꼼하다 체크 해주다 되다 것 같다 등기부 부본 을 직접 발급 받다 반드시 내용 확인 집주인 인적 사항 근저당 설정 압류 등 확인 신분증 진위 확인 및 실소 유권자 와 직접 만나다 계약 하다 전입 신고 및 확정 일자 받다 전 세금 반환 보증 보험 가입 하다 공인 중개사 신분 조회 국가 공간 정보 포탈 에서 조회 근저당 금액 이 매 매가 의 초 과시 계약 하다 않다 계약 전 건축물 대장 을 확인 하다 불법 적 인 용도 변경 이 있다 확인 하다 전입 신고 나 확정 일자 미루다 달라 고 요구 하다 시 의심 하다 집주인 이 확정 일자 전 에 근저당 을 설정 하다 수 있다 전 세 대출 이 안되다 해도 대출 이 나오다 건물 인지 확인 해보다 주변 전 세 시세 말고 매매 시세 도 꼭 같이 확인 하다 깡통 전세 사기 방지
