질문,답변
서울 에서 전세 매물 구 하다 중 인데 궁금하다 있다 부동산 에서 상담 받다 매물 이 두 개 있다 둘 다 오피스텔 이고 준공 되다 각각 년 매물 년 정도 매물 되다 매물 이다 매물 은 전세 가가 매 매가 의 매물 은 이상 이다 두 개 다 보증금 보험 이 가입 되다 대출 이 되다 곳 이다 매물 은 보증금 보험 가입 을 위해 전세 가르다 낮추다 때문 에 월세 만원 이 추가 로 필요하다 하다 두 매물 다 계약 시 에 임대 인 세금 체납 여부 확인 가능하다 특약 사항 으로 아래 의 내용 을 넣다 주다 하다 안전하다 매물 이다 요 임대 인 은 전세계약 년 계약 기간 동안 후 순위 대출 근저당 설정 을 받다 수 없다 임대 인 은 잔금 전 가압류 및 가등기 가 설정 되다 모든 책임 을 지다 임대 인 은 임차 인 입 주일 잔금 날 에 전입 신고 완료 후 다음 날 시 이후 임대차 효력 발생 시 까지 향후 일간 기타 권리 하다 등 을 발생 시키다 경우 해당 계약 은 무효 로 하다 계약해지 하다 하다 임대 인 은 임차 인 계약 만기일 까지 다음 세 입자 가 안구 하다 계약 만기일 에 보증금 을 즉시 반환 키로 하다 보다 계약 은 임대 인 의무 반환 보증 보험 가입 조건 의 계약 이며 반드시 가입 하다 하다 전세 보증금 년 가입 임차 인 보증 료 부담 보증 보험 가입 불 가시 계약금 및 보증금 전액 즉시 반환 한 다임 대인 은 임차 인 의 청년 버팀목 전 세 자금 대출 에 적극 협조 하다 청년 버팀목 전 세 자금 대출 불 가시 계약금 전액 반환 하다 한 다임 차이다 대출 밉다 발생 시 내용 증빙 이 가능하다 야하다 부동산 거래 신 고법 에 따르다 임대차 신고 대상 주택 으로 계약 당사자 가 계약 일로 부터 이다 신고 하다 안내 함상기 특약 외 의 사항 은 주택임대차보호법 에 준 하다 민법 상 계약 에 관 한 규정 및 일반 부동산 거래 관례 에 따르다 추가 내용 은 임대 인과 임차 인 이 협의 하다 처리 하다,전세계약 하다 때 서류 를 개인 이하 면 복잡하다 중개인 을 통해 서 하다 경우 가 많다 그리고 사기 를 당하다 걱정 도 있다 전문가 의 도움 을 받다 보증 보험 가입 은 개인 이 하다 수 있다
안녕하다 부동산 일 을 막 시작 한 부리다 이다 제 가 한 달 정도 돼다 모르다 너무 많다 전세계약 은 왜 중개인 이 반드시 필요하다 보증 보험 가입 은 누가 가입 을 하다 알다 분 계시다 ㅠ 너무 제 자신 이 짜증나다 답답하다 올리다 보다 그리고 부동산 관련 하다 저 의 멘토 가 되어다 분 댓글 로 남기다 ㅠ 도와주다,신탁 등기 되다 부동산 은 그렇다 않다 부동산 보다 권리 관계 가 복잡하다 때문 에 임대차 계약 을 체결 하다 때 많다 주의 를 기울이다 하다
이번 에 신축 오피스텔 전세계약 을 하다 하다 보 니까 해당 물건 이 신탁 부동산 매물 이고 등기부 등본 갑구 에 신탁 원부 라 기재 되어다 있다 그래서 전세계약 절차 를 수행 하다 하다 임대 인 집주인 과 계약 을 하다 때 아직 이 전 등기 가 안되다 있다 때문 에 수 탁자 부동산 신탁 주식회사 의 동의 서 가다 필히 있다 하다 것 을 압 니 다그 래서 부동산 중개인 에게 말 하다 그건 다세대 만 해당 되다 거 고 아파트 및 오피스텔 은 해당 이 안되다 하다 맞다 것 인가요 맞다 내 용이 라면 출처 가 어떻다 되다 답변 감사하다 내공 부리다 상세 한 설명 해주시 면 정말 감사하다 ㅠㅠ,전세 계약금 입금 및 계약서 작성 이 완료 되어다 임대차 계약 도 신고 가 완료 되어다 하지만 아직 잔금 을 치르다 전 에 집주인 이 아파트 를 매매 하다 부동산 어플 에 등록 한 것 을 알아차리다 또한 계약서 작성 시 에 집 매매 에 대한 정보 는 듣다 못 하다 이렇다 경우 가 흔 한지 전세 계약 진행 중 에 매매 가 진행 되다 대해 궁금하다 것 같다 또한 양 측 부동산 이 아니다 제 부동산 이 매매 등록 하다 해당 사항 에 문제 가 없다 궁금하다 것 같다 그리고 본인 부동산 에 어떻다 내용 을 확인 해보다 것 이 좋다 대한 조언 을 원하다 것 같다 전세 계약 진행 중 매매 가 이루어지다 경우 는 드물다 발생 하다 수 있다 보다 안정 적 인 계약 을 위 하다 부동산 관련 법률 을 자다 숙지 하고 전문가 의 도움 을 받다 것 이 좋다 양 측 부동산 이 아니다 제 부동산 이 매매 등록 한 경우 에는 해당 부동산 의 신뢰 성과 신 용도 를 확인 하다 것 이 중요하다 부동산 전문가 나 법률 전문가 의 조언 을 듣다 것 도 도움 이 되다 수 있다 또한 부동산 에 등록 되다 정보 와 해당 아파트 의 현황 관련 법규 를 확인 해보다 것 도 좋다 방법 이다 부동산 전문가 형 누님 들 의 조언 을 참고 하다 더욱 좋다 것 이다
안녕하다 신축 아파트 원 계약 자로 저희 어머니 가 계약 을 하다 현재 아파트 관련 하다 여러 질문 들 이 있다 현재 계약서 에 있다 금액 은 은행 에서 중도 금 대출받다 억 천 을 제외 하 곤 잔금 까지 전부 완납 하다 취득세 도 해당 시청 에서 납부 하다 소유권 이 전 등기 는 월 중순 까지 내야 가산 세 가 안 붙다 하다 내 려고 하다 은행 에 중도 금 대출 상환 을 하다 그 증명서 를 제출 하다 아파트 쪽 에서 승인 을 내주다 그때 부터 소유권 이전 등기 신청 이 가능하다 혹은 중도 금 대출 을 잔금 대출 로 바꾸다 중도 금 대출 쪽 은행 은 상환 하고 잔금 대출 을 받다 은행 으로 서류 가 넘어가다 그 쪽 법무사 를 통해 소유권 이전 등기 신청 이 가능하다 알 게 되어다 이러하다 상황 에서 해당 아파트 를 부동산 통 하다 전세 로 올리다 놓다 계약 하다 사람 이 나타나다 세 입자 도 디딤돌 대출 을 통 하다 돈 을 받다 월 초 쯤 에나 잔금 완납 이 가능하다 하다 저희 는 월 일 전 까지만 집단 대출 이 가능하다 만약 세 입자 가 계약 을 하다 하다 계약 을 취소 하다 버리다 해당 대출 을 못 받다 서다 그렇다 저희 가 잔금 대출 을 받다 되다 세 입자 로부터 전 세금 잔금 을 받다 다시 은행 에 잔금 대출 상환 을 하다 중도 상환 수수료 정도 나오다 알 고 있다 계약 취소 를 감안 하다 일단 신청 을 하다 맞다 대출 이후 바로 갚다 내다 중도 상환 수수료 보다 중도 금 상환 대출 납 기일 을 넘기다 연체 되다 가산 세 소유권 이전 등기 가산 세 가다 더 낮 을 것 같다 하다 이렇다 상황 이면 일단 잔금 대출 을 신청 하다 옳다 또 세 입자 도 디딤돌 대출 을 하다 하다 저희 가 은행 잔금 대출 을 하다 하다 심사 에 탈락 하 거나 하다 대출 에 불이익 이 있다 수 있다 그리고 아파트 를 전세 로 판매 하다 저희 상황 에서 소유권 이 전 등기 관련 하다 주의 하다 상황 이 있다 저번 에 잠깐 월세 의 경우 는 소유권 이 전 등기 를 세 입자 측 에서 먼저 하다 큰일 나다 들다 적 이 있다,상관없다 은행가 서 연장 되어다 하다 되다 아니다 새롭다 계약서 들다 되다
원래 계약 은 월 까지 인데 월일 까지로 미루다 다시 월 일로 미루다 되어다 첫 번째 미루다 때 는 임대 인 이 부동산 에 방문 하다 자다 작성 하다 내일 다시 부동산 가다 월 일로 미루다 임대 인 이 방문 을 귀찮다 거절 하다 부동산 에선 임대 인분 이 안 오다 상관없다 말씀 하다 상관 이 없다 전 세 대출 이랑 보증 보험 연장 하다 되다 새롭다 임대차 계약서 를 작성 하다 되다 이경우 어떻다 하다 답변 은 정중하다 거절 하다,아파트 매매 가가 억천억천 에 올리다 있다 전세 가 억 정도 라면 비싸다 수준 이라고 볼 수 있다 일반 적 으로 전세 가 비율 은 매 매가 의 정도 가 안전하다 보다 즉 매매 가가 억천억천이 라면 전세 가다 억천백만억천만 원 정도 가 적절하다 수준 이다 억억이 면 경매 시 보증금 전액 을 못 받다 있다
신혼부부 라 이번 에 전 세 집 을 구 하다 하다 그런데 아직 많이 무지하다 질문 드리다 아파트 현재 매매 가가 억천억천 올리다 있다 전세 가 억 정도 라면 비싸다 수준 인가요 만약 그리고 최악 으로 가정 하다 집 이 경매 로 넘어가다 하다 보증금 을 돌리다 받다 수 있다 안전하다 수준 인지 궁금하다,금리 인상 등 으로 최근 전 세 집 이 경매 에 넘어가다 사례 가 급증 하고 있다 전 세 집 이 경매 에 넘어가다 경우 먼저 권리분석 을 진행 하다 경매 배당 절차 에서 보증금 전액 을 회수 하다 수 있다 따지다 보아 야 하다 대항력 있다 선 순위 임차 인 이 라면 낙찰 자 에게 보증금 반환 을 요구 하다 수 있다 때문 에 상대 적 으로 안전하다 편이 지만 최근 부동산 가격 하락 으로 경매 가 계속 하다 유찰 되다 현상 이 나타나다 있다 전 세 보증금 보험 을 가입 하다 하다 석 연 치 않다 이유 들 로 보증 이행 을 하다 않다 경우 가 허다 하다 보증 보험 회사 의 입장 에서도 세 입자 에게 보증채무 를 이행 한 뒤 집주인 에게 구상권 을 행사 하다 보증금 을 회수 하다 하다 집주인 으로부터 보증금 회수 가 불가능하다 경우 이다 고스 란 히 보증 보험 회사 의 손해 로 귀속 되다 때문 이다 이 경우 보증금 반환 에 대한 부담 은 고스 란 히 세 입자 가 부담 하다 되다 경매 배당 절차 에서 보증금 을 반환받다 못 하다 것 이 확실하다 경우 에는 집주인 을 상대로 보증금 반 환청 구 소송 을 진행 하다 후 신속하다 판결 문 을 확보 하다 집주인 의 다른 재산 에 강제집행 절차 를 진행 하다 하다 경매 절차 는 복잡하다 편이 고 진행 과정 에서 여러 변수 가 많다 때문 에 보다 정확하다 상담 을 원하다 관련 자료 를 지다 차다 전문 변호사 와 상담 을 진행 해보다 것 이 좋다 전 세 집 이 경매 에 넘어가다 깡통 전세 는 전 세 사기 와 밀접하다 관련 이 있다 최근 세 입자 들 의 소중하다 보증금 을 떼다 먹다 전 세 사기 가 기승 을 부리고 있다 세 입자 들 의 각별 한 주의 가 필요하다 상황 이다 하지만 사기꾼 들 의 수법 이 워낙 교묘하다 때문 에 조심 을 하다 하다 눈 뜨다 코베 이 는 식 으로 전 세 사기 를 당하다 십상 이다 전 세 사기 에 대처 하다 방법 으로는 형사고소 보증금 반 환청 구 소송 채권 추심 강제집행 이 있다 이 세 가지 절차 가 유기 적 으로 진행 되어다 전세 사기 사건 에서 피해 를 회복하다 수 있다
신축 빌라 에 월경 전 세 세 입자 로 이다 나서다 년 이 지난 뒤 에야 깡통 전세 인걸 알다 분양 당시 매매 가 억만원 전세 가 억만원 이 이다 억만원 으로 안심 전 세 대출 대출 을 이용 하다 이다 월 중순 조금 안되다 시점 에 집주인 이 바뀌다 찾아보다 전형 적 인 건축 주 와 분양 사무실 과 바지 사장 을 이용 한 무 개다 투기 깡통 전세 사기 인걸 인지 하다 부동산 등기 를 확인 해보다 현재상황 은 이러하다 이다 나서다 바로 전입 신고 및 확정 일자 를 받다 그 이전 을 구 에 있다 저당권 설정 은 그 이전 건축 주 집주인 의 건축 당시 은행 대출 로 보이 고 계약서 에 말 소 조건 으로 기재 후 이다 얼마 알다 바로 말다 되어다 그리고 몇 달뒤 에 집주인 이 바뀌다 현재 갑구 에 새롭다 바뀌다 집주인 바지 사장 앞 으로 압류 가 건강 보험 공단 및 지자체 징수 과 압류 가 들어오다 고전 입신 고 및 확정 일자 는 이다 동시 에 하다 금도 거주 하다 한번 도 전출 을 한 이력 이 없다 그 이후 집주인 변경 및 새 집주인 압류 가 들어오다 다행하다 저 는 대항력 있다 선 순위 임차 인 으로 보이다 구 에는 현재 는 아무 것 도 없다 현재 전세 만기 가 개월 정도 남다 상황 이고 부동산 경매 예정 통지서 현재 바지 사장 집주인 앞 으로 온 통지서 를 받다 되어다 아마도 만 기 이전 에 집 이 경매 로 넘어가다 같다 판단 되다 여기 서 부터 질문 이다 제 가 알다 집 이 경매 에 넘어가다 신축 빌라이 므 로 현재 공시 가가 억 나오다 시세 조회 그러면 감정 가가 어떻다 되다 모르다 억억천사이 로 예상 되다 이경우 에 대항력 있다 선 순위 임차 인 인 제 보증금 억만원 보다도 낙찰 가액 이 적다 제 가 배당 요구 를 하든 하다 않다 분명 무한 유찰 이 되다 보이 고 그 이전 에 나머지 후순위채권 자 가 신청 한 경 매 일 경우 대항력 있다 선 순위 임차 인 인 제 가 존재 하다 한 말 소 기준 권리 가 저 의 임차보증금 이 되다 경 매가 가 억만원 이상 이 되다 않다 무 잉여 기각 이 되다 뻔하다 상황 인데 이런 경우 에는 임차 인 인 제 가 보증금 반환 소송 및 강제 경매 신청 후 에 입찰 을 하다 낙찰 가액 과 배당 액 을 상계 처리 하다 인수 하다 있다 알다 제 가 강제 경매 를 신청 후 에 계속 유찰 시키다 가장 저렴하다 금액 으로 낙찰 받다 구입 하다 나은지 아니다 첫 회차 에 바로 낙찰 받다 나은지 궁금하다 현재 안심 전 세 대출 을 이용 하고 있다 낙찰 받다 순간 유 주택 자 가 되어다 안심 전 세 대출 을 일시 납 상환 하다 는걸 로 알다 낙찰 금액 이야 상계 처리 하 면 되다 하지만 전 세금 상 환하다 되다 어떻다 처리 하다 하다 요 이미 보유 한 주택 은 주택 담보 대출 도 많이 안나 오는 걸 로 알다 아니다 제 가 강제 경매 를 하다 않다 채권자 가 경 매 진행 을 해도 무 잉여 기 각 이안 나 올 수도 있다 종합 적 으로 보다 때 보증금 최대 회수 및 이 상황 을 현명하다 넘다 방법 은 없다 정말 전문가 분들 의 고견 을 진심 으로 여쭙숩니 다 내공 많이 겁니다,금리 인상 등 으로 최근 전 세 집 이 경매 에 넘어가다 사례 가 급증 하고 있다 전 세 집 이 경매 에 넘어가다 경우 먼저 권리분석 을 진행 하다 경매 배당 절차 에서 보증금 전액 을 회수 하다 수 있다 따지다 보아 야 하다 대항력 있다 선 순위 임차 인 이 라면 낙찰 자 에게 보증금 반환 을 요구 하다 수 있다 때문 에 상대 적 으로 안전하다 편이 지만 최근 부동산 가격 하락 으로 경매 가 계속 하다 유찰 되다 현상 이 나타나다 있다 전 세 보증금 보험 을 가입 하다 하다 석 연 치 않다 이유 들 로 보증 이행 을 하다 않다 경우 가 허다 하다 보증 보험 회사 의 입장 에서도 세 입자 에게 보증채무 를 이행 한 뒤 집주인 에게 구상권 을 행사 하다 보증금 을 회수 하다 하다 집주인 으로부터 보증금 회수 가 불가능하다 경우 이다 고스 란 히 보증 보험 회사 의 손해 로 귀속 되다 때문 이다 이 경우 보증금 반환 에 대한 부담 은 고스 란 히 세 입자 가 부담 하다 되다 경매 배당 절차 에서 보증금 을 반환받다 못 하다 것 이 확실하다 경우 에는 집주인 을 상대로 보증금 반 환청 구 소송 을 진행 하다 후 신속하다 판결 문 을 확보 하다 집주인 의 다른 재산 에 강제집행 절차 를 진행 하다 하다 경매 절차 는 복잡하다 편이 고 진행 과정 에서 여러 변수 가 많다 때문 에 보다 정확하다 상담 을 원하다 관련 자료 를 지다 차다 전문 변호사 와 상담 을 진행 해보다 것 이 좋다 전 세 집 이 경매 에 넘어가다 깡통 전세 는 전 세 사기 와 밀접하다 관련 이 있다 최근 세 입자 들 의 소중하다 보증금 을 떼다 먹다 전 세 사기 가 기승 을 부리고 있다 세 입자 들 의 각별 한 주의 가 필요하다 상황 이다 하지만 사기꾼 들 의 수법 이 워낙 교묘하다 때문 에 조심 을 하다 하다 눈 뜨다 코베 이 는 식 으로 전 세 사기 를 당하다 십상 이다 전 세 사기 에 대처 하다 방법 으로는 형사고소 보증금 반 환청 구 소송 채권 추심 강제집행 이 있다 이 세 가지 절차 가 유기 적 으로 진행 되어다 전세 사기 사건 에서 피해 를 회복하다 수 있다
집 을 나가다 자해 서 알아보다 중 인데 요 청년 전월세 대출 이 있다 전 세로 가면 살 만 하다 관심 이 가다 이렇다 쪽 지식 이 아무 것 도 없다 부동산 에 청년 대출 을 받다 절차 나 세부 사항 을 안내 해주다 전 세로 살 게 되다 신고 절차 등 은 무엇 을 하다 또 특별하다 무엇 의 주의 하다 알다,등기부 등본 주민등록 초본 임대차 계약서 등 을 보아 야 정확하다 판단 이 가능하다 것 으로 보이다
억 천 오피스텔 전세 로 들어오다 계약 당시 건물 등기부 등본 에 가압류 나 근저당 없다 그 후 확정 일 자랑 전입 신고 다 하다 월 이 면 전세 계약 이 끝나다 집주인 이 집 채 를 보유 하다 그 에 대한 세금 약 억 이상 을 못 내다 전 월 일 날 계약 을 하다 등기 사항 전부 증명서 를 보다 가다 소유권 이전 이 돼다 접수 년 월 일 등 시 원인 월 일 매매 이다 제 가 전세 를 하다 당 시월 일 소 유주 는 이다 그 전 날월 일 에 매매 가 돼다 가다 아니다 가다 소유 주 여야 하다 게 아니다 소유권 이전 접수 날인 일 전 에 확정 일 자랑 전입 신고 를 하다 등기 원인 이유 와 상관없다 경매 시 대항력 있다 선 순위 임차권 이 되다 것 인가요,전세 로 계약 하다 집 이 매매 와 동시 에 이뤄지다 있다 매도 인과 전세 계약 을 하다 하다 통상 적 으로 매수 자 와 하다 경우 도 있다 매매 계약 이 파기 가 되다 수도 있다 계약금 만 지불 한 상황 이 라면 계약 의 해제 도 가능하다 때문 에 매 수인 과의 계약 은 전세 입자 입장 에서도 위험하다 수 있다 따라서 전세 계약 당시 의 소유자 인 매도 인과 계약 을 하다 잔금 도 매도 인과 진행 하다 하다 매매 가 이루어지다 전 세 보증금 을 안전하다 지키다 방법 은 전 세금 반환 보증 보험 에 가입 하다 추천 하다 혹시 나 계약 만료 시 전 세 보증금 을 임대 인 이 돌려주다 못 하다 상황 이라도 보증 기관 에서 대신 돌려주다 형태 이다 좀 더 안심 하고 계약 을 하다 수 있다 것 이다 잔금 과 동시 에 전입 신고 와 확정 일자 를 받다 두다 되다 잔 금일 에 매 수인 이 근저당 을 설정 하다 않다 계약 시 특약 사항 에 넣다 수 있다 좋다 그렇다 않다 전입 신고 이후 에 등기부 등본 을 하다 번 더 확인 하다 편이 좋다 매도 인 과 전세계약 을 하다 매매 계약 을 하다 되다 전세 관련 하다 의무 와 권리 를 포괄 승계 를 하다 되다 전 세 입자 의 경우 매 수인 의 인적 사항 은 모르다 때문 에 불안하다 수 있다 그래서 잔금 시 매수 인과 전세 계약 을 새롭다 하다 방법 도 고려 하다 볼 수 있다 전세 계약 을 하다 때 이러하다 부분 에 대해 미리 협의 를 하다 특약 사항 에 반영 을 하다 가장 확실하다 방법 이 되다 것 이다
월세 가 너무 부담 되다 전세 로 옮기다 전세계약 을 하다 청년 전세 자금 대출 받다 내일 이 대 출금 나오다 날 즉 잔금 치르다 이다 날 이다 늘 이사 하다 집 청소 하고 있다 갑자기 누가 비번 을 누르다 들어오다 매매 내놓다 부동산 이라는 데 이 게 무슨 말 인가 싶다 중개인 에게 확인 요청 을 하다 그런데 집주인 이 바뀌다 이야기 를 하다 집 보기 전 집 볼때 계약서 작성 전 후 그리고 주가 넘다 지금 까지 어떠하다 말 도 없다 갑자기 전 세 끼 고 매매 들어가다 지다 하다 거의 사기 당 한 기분 이다 진작 말씀 해주다 하다 부분 아니다 따지다 본인 도 모르다 하다 이중 계약 으로 다른 부동산 가다 계약서 작성 하다 하다 아무리 그래도 중개사 가 모르다 말 이 되다 그리고 그 부동산 에서는 당연하다 사전 에 고지 해주다 하다 부분 아니다 악의 적 으로 말 하다 않다 다르다 생각 이 들다 않다 집주인 께 아무리 연락 하다 받다 않다 저희 아빠 와 남자친구 번호 는 받다 남자친구 가 집주인 께 여쭈다 보다 이미 작년 월 에 매매 계약서 를 작성 하다 매매 하다 새 집주인 분 이 돈 이 없다 아직 잔금 은 못 치다 루고 전세 를 끼 고 계약 하다 하다 하다 내일 동 시 계약 을 하다 예정 이다 저 는 등기부 등본 확인 하다 때 현 집주인 이 맞다 전혀 그렇다 사실 을 듣다 못 하다 때문 에 상상 도 못 하다 전혀 모르다 알다 계약 하다 않다 당장 내일 인데 낼 아침 은행 달려가다 대출 막다 하다 지 계약 깨다 계약금 은 돌리다 받다 수 있다 건지다 안전하다 계약 인지 제 가 설명 받다 못 한 부분 은 어떻다 책임 을 물 고 피해 보상 받다 있다 하나 하나 다 알다 너무 화가 나다 어이 가 없다 잠도 안 오다 제 가 순위 가 되게 각서 를 써주다 안전하다 걱정 하다 말 라는 말 만 계속 하다 그냥 이제 믿다 없다 제 가 새집 청소 하다 그 부동산 중개인 분 을 만나다 않다 저 는 아무 것 도 모르다 당하다 잔금 도 그냥 열 시전 에만 보내다 되다 부동산 안나 와도 되다 하다 저 는 호구 이다 당장 내일 이 잔금 치르다 날 이고 지금 살다 집도 낼 모레 까지 빼기 로 하다 제 가 여기 서 어떻다 하다 하 는걸 끄다 내 일 아침 대출 막다 계약 파기 하다 경우 사전 에 설명 을 듣다 못 하다 중개업 자 는 설명 의무 를 다 하다 않다 계약금 일부 나 보상 을 받다 수 있다 혹은 소송 으로라도 계약금 을 받다 수 있다 계약 파기 하다 경우 현재 거주 하다 집 에서는 기존 계약 만료 기간 까지 있다 되다 요 계약 만료 일 은 일주일 정도 남다 제 가 집 을 빼기 로 하다 날 다음 세 입자 가 바로 들어오다 되다 상황 이다 다음 세 입자 의 중개인 도 같다 중개인 이구 요 계약 하다 경우 이미 매매 계약 은 전세계약 보다 먼저 한 것 같다 이 부분 도 중개인 은 끝 까지 설명 없다 집주인 통해 알 게 되다 그러나 등기부 등본 상 에는 현 집주인 이 기재 되어다 있다 제 가 내일 전입 신고 를 하다 순위 가 되다 맞다 계약 후 새롭다 집주인 과 계약서 를 다시 작성 하다 하다 알아보다 그게 오히려 불리하다 말 도 있다 꼭 새롭다 작성 하다 하나요 새롭다 작성 하다 경우 이전 의 전입 신고 확정 일자 받다 순위 는 사라지다 중개인 저 에게 어떠하다 설명 도 하다 않다 계약서 에 사인 만 하다 하다 중개인 들 에게 저 는 어떻다 조치 를 취할수 있다 협회 에 이의신청 시청 에 신고 고소하다 것 을 알아보다 구체 적 인 방법 혹은 더 효과 적 인 방법 은 없다,전세 계약 시 주인 이 집 을 내주다 않다 경우 상황 에 따르다 다양하다 대응 방법 이 있다 수 있다 먼저 전세 계약서 에 명시 되다 계약 조건 과 기한 을 확인 하다 보시 는 것 이 좋다 계약서 에 명시 되다 조건 에 따르다 주인 에게 문제 를 제기 하고 해결 을 요구 하다 수 있다 만약 주인 이 돈 이 없다 주장 하고 이사 를 간다 는 말 을 하다 이다 전세 계약 을 위반 하다 행위 일 수 있다 이 경우 법적 인 조치 를 취할 수도 있다 법률 적 인 조언 을 받다 위 하다 변호사 나 법률 전문가 와 상담 하다 것 이 좋다 또한 전세 계약 시 전세 보증 보험 에 가입 하다 않다 하다 전세 계약서 에 보증금 에 대한 조항 이 명시 되어다 있다 해당 조항 에 따르다 보증금 을 환급 받다 수 있다 절차 를 따르다 수 있다 이 경우 에도 법률 적 인 조언 을 받다 것 이 좋다 마지막 으로 부동산 중개사 나 전문가 에게 상담 을 요청 하다 것 도 도움 이 되다 수 있다
