질문,답변
부동산 의 표시 임대차 예정 금액 가계약 금 본계약 체결 일 임대 인 계좌 번호 거래 약정 내용 가다 다른 약정 이 없다 하다 임대 인 은 가계약 금 의 배액 을 상환 하고 임차 인 은 가계약 금 을 포기 하고 계약 을 해제 하다 수 있다 가계약 금 송금 후 임대 인 임차 인 어느 한쪽 이 본계약 을 불 이행 하 는 경우 는 가계약 금 을 위약금 으로 본 다나 가계약 거래 약정 내 용의 효력 은 가계약 금 송금 일로 부터 본계약 이 체결 되다 때 까지 유효하다 보다 가계약 은 임대 인 임차 인 에게 위 부과 조건 이 기록 되다 보다 가계약 내용 의 문자 를 핸드폰 으로 발신 하다 동의 를 받다 가계약 금은 온라인 송금 하다,대항력 이 없다 전 세 입자 분들 이 강제 로 방 을 빼다 하다 것 은 맞다 대항력 있다 없다 등기부 매 각 물건 명세서 와 같다 서류 로 확인 하다 수 있다 부동산 을 통해 서 확인 하다 보시 면 알 수 있다 근저당 없다 권리 에 문제 없다 대출 도 가능하다
등기부 를 확인 해보다 작년 에 경매 로 되다 새 입자 들 이 강제 로 방 을 빼다 하다 물어보다 그 집 을 년 에 씩 올리다 다른사람 이 매매 하다 값 이 오르다 전 세 입자 분들 이 강제 로 방 을 빼다 하다 하다 그리고 부천 에 있다 부동산 에서 안산 까지 거래 하다 이상하다 동 시 진행 을 하다 승계 확인 서 를 쓴다 주민 번호 를 물어보다 카뱅 으로 하다 하다 이집 을 전세계약 하다 되다 끄다,세 입자 대체 한 후 보증금 반환 해주다 되다 전세 를 연장 하다 동 일 조건 이 라면 계약서 작성 하다 않다 되다 고정 작성 하고 싶다 대필 료 만 부담 하다 되다
안녕하다 오피스텔 년 전세 를 내주다 세 입자 가 계약 만료 달다 연락 이 오다 년 연장 을 희망 하다 그렇게 하라 구 이야기 를 하고 전 세금 인상 이야기 를 하니 생각 을 좀 해보다 이야기 해주다 말 을해 서 기다리다 이후 에 하다 이야기 가 되어다 계약 하다 부동산 이랑 말 을 마치다 기다리다 계약 기간 만료 가 되어다 이제 와 서다 연장 을 안 하다 이야기 를 하다 제 가 목돈 이 묶이다 전 세금 을 다음 세 입자 를 구해 서 내주다 이런 경우 에는 다음 세 입자 구할떄 까지 기다리다 하다 가요 추가 로 궁금하다 항전 세금 바로 못줄 경우 에 경매 로 넘어가다 건지다 연장 하다 되다 경우 계약서 를 써다 복비 를 지급 하다,만 기전 에 나가다 계약위반 이 므 로 집주인 한테 그 만큼의 보상 을 해주다 하다 생각 하다 부동산 계약서 에도 년 을 채우다 하다 급하다 사정 때문 에 나가시 는 건 계약위반 이니까 요 예 를 들어서다 남다 계약 기간 이 개월 남다 개월 만큼의 월세 를 주다 하다 하다 거 같다
올 초 전세기 간 년 후 전세 금리 변동 으로 만원 되다 이자 를 내다보다 금액 의 부담 이 너무 크다 월 중순 쯤 집주인 에게 월세 전환 이나 전세 를 내달 라고 말씀 을 드리다 만기 년 월 현 시점 까지 보다 사람 도 없다 저희 도 살다 바쁘다 보다 잊다 지내다 자다 매물 을 보다 오다 계약 의사 를 밝히다 저희 랑 날짜 를 조율 하다 되다 상황 이라 말 해주다 거기 서 원하다 날짜 와 저희 가 가능하다 날 이 도무지 맞추다 않다 거래 불발 로 부동산 과 얘기 하고 만 기 계약 그대로 저희 가 살 고 정리 하 는걸 로 얘기 가 끝나다 집주인 이 거기 날짜 에 맞추다 나가다 저희 가 내 달라 햇 고 취소 얘길햇 어 야 지다 왜실 없다 사람 만들다 역정 을 내다 그래서 예 사장 님 저희 가 인지 하다 산 거인 정하나 저희 도 급하다 때 는 개월안 에 정리 가 되다 그때 는 보다 사람 이 없다 놓치다 근데 계약 상 아직 기간 이 있다 이래저래 안 맞다 그냥 원래 대로 살다 추후 금전 적 인 문제 그 집 보다 온 다음 세 입자 와의 문 제 부분 을 저희 에게 책임 을 묻다 어떤 문 젠진 모르다 부동산 입장 은 정상 계약 만기 후 지다 때 사람 이 안구 하다 끄다 바 저러다 같다 하다 여기 서 미리 취소 얘길 못 한 저희 잘못 인정 하 오 나 저희 도 급하다 불 끄다 시간 도 개월 이나 흐르다 반년 남다 하다 살기 바쁘다 진짜 로 구두 로 하다 전 세 얘기 도 만 기전 에 내뱉다 은 대로 저희 가 나가야 하다 맞다 계약서 대로 살 고 나가다 문제 가 없다 책임 을 지다 야하다 부분 이 정말 있다 궁금하다 늦다 시간 장문 의 글 죄송하다 뭐라다 좋다 답변 부탁드리다,질문 자 님 이 작성 해주다 내용 과 같이 전입 신고 점유 를 시작 한 나중 일 의 기준 으로 다음 날로 부터 대항력 이 발생 되다 예 를 들다 까지 계약 을 하다 잔 금일 은 로 하다 경우 잔 금일 에 전입 시 고 와 점유 확정 일자 까지 받다 대항력 우선변제권 은 부터 효력 이 발생 되다 만일 임대 인 이 은행 에 대출 을 받다 당일 근저당권 설정 등기 를 마치다 경우 임차 인 은 은행 보다 순위 가 후 순위 가 되어다 전 세금 보호 를 받다 못 하다 되다 것 이다 특약 사항 에 기재 하다 부분 은 당사자 사이 에 효력 은 있다 은행 보다 후 순위 가 되다 점 에서 유의 하다 하다 것 으로 보이다
아파트 전세 계약 을 하다 확인 하다 전입 신고 다음 날 부터 대항력 이 생기다 잔 입신 고 당일 임대 인 이 대출 을 받다 문제 가 되다 하다 그래서 특약 사항 을 보다 임대 인 은 잔금 시 까지 물건 에 대해 담보 제공 이나 기타 채무 를 부담 하다 행위 를 하다 않다 하다 명시 를 하다 만약 임대 인 이 잔금 전 에 대출 을 신청 하다 기타 채무 를 부담 하 는 행위 를 하다 것 이 되어다 특약 사항 위반 으로 판단 되다 맞다 판단 인지 요,신탁 등기 가 되어다 있다 상태 에서 임대차 계약 을 체결 하다 경우 신 탁자 의 동의 를 받다 그대로 진행 하다 법 에 따르다 유효하다 계약 으로 성립 되다 만큼 걱정 을 않다 되다 것 으로 보이다
계약 시 근저당 이 억 일 때 전세계약 후 확정 일자 받다 후 에 건물 주가 추가 억 대출 하다 경매 에 붙이다 때 세입 자 는 확정 일자 후 에 억 보다 먼저 보호 받다 있다 전 세금 을 다 돌리다 받다 있다,해당 부동산 의 실 거래 가격 과 등기부 등본 상 의 선 순위 권리 를 확인 하다 하다 선 순위 권리 임차 보증금 이 통상 적 으로 실 거래 가격 의 가다 넘다 보증금 회수 가 일부 또는 전 부가 문제 생기다 있다
얼마 전 새롭다 이다 되다 주택 의 전세 계약 을 진행 하다 현재 계약금 만 일부 송금 을 하다 상태 이고 잔 금일 은 아직 한 달 정도 남다 집 와 서다 계약서 계약 사항 을 꼼꼼하다 읽다 가다 조금 꺼림칙하다 조항 들 이 있다 것 같다 질문 남기다 아래 세부 확인 사항 에 임대 인 이 개인 공인 중개사 의 관련 서류 목적 물 현황 조사 서 임차 현황 조사 서 전입 세대 열람 내 역서 제출 요구 에 불응 하다 쓰이다 혹시 보통 저런 경우 어떻다 이유 때문 에 제출 에 불응 하다 임차 인 은 위 부동산 에 존재 하다 선 순위 권리 로 인하다 경매 등 이 실행 되다 경우 임차보증금 의 전부 또는 일부 를 반환받다 못 하다 수도 있다 음 을 확인 하다 부가 적 으로 어떻다 방법 을 통 하다 후 에 혹시 모르다 사태 를 대비 하다 수 있다 전 세 자금 보증 보험 을 들다 괜찮다 잔금 날 에 잔금 입금 하다 순위 가 자동 상승 하다 것 인지 부동산 관련 지식 이 부족하다 전세계약 이 처음 이라 불안하다 것 이 너무 많다 이 외 에도 혹시 모르다 나중 의 불미 스러운 사태 에 대비 하다 제 가 미리 대비 하다 수 있다 방법 들 이나 조언 들 을 이해 하다 쉬다 알다,년 전세계약 의 전 세금 일부 를 임차 인 개인 사정 으로 인하다 월 중순 에 지불 하다 신규 임차 인과 임대 인 의 계약 에서 발생 하다 임대 인 부담 의 중개 수수료 는 계약 의 당사자 인 임대 인 이 지불 하다 하다 또한 임차 인 개인 사정 으로 인하다 전 세금 일부 를 임대 인 이 먼저 주다 야하다 의무 는 없다 임차 인 이 다른 주택 을 임차 하다 위 한 계약금 으로 사용 하다 위 한 경우 임대차 종료 일 에 대한 확약 을 받다 미리 지불 하다 경우 도 있다
년 전세 계약 이다 임차 인 개인 사정 으로 인하다 전 세금 일부 를 월 중순 에 받다 싶다 하다 추후 부동산 비 를 임대 인도 내야 하나요 또한 임차 인 개인 사정 으로 인하다 전 세금 일부 를 먼저 주다 상관없다 가요,년 전세계약 의 전 세금 일부 를 임차 인 개인 사정 으로 인하다 월 중순 에 지불 하다 신규 임차 인과 임대 인 의 계약 에서 발생 하다 임대 인 부담 의 중개 수수료 는 계약 의 당사자 인 임대 인 이 지불 하다 하다 또한 임차 인 개인 사정 으로 인하다 전 세금 일부 를 임대 인 이 먼저 주다 야하다 의무 는 없다 임차 인 이 다른 주택 을 임차 하다 위 한 계약금 으로 사용 하다 위 한 경우 임대차 종료 일 에 대한 확약 을 받다 미리 지불 하다 경우 도 있다
집다 매매 를 하다 전세 를 주다 집다 이번 에 건축 하다 준공 서류 받다 한 달이 걸리다 로 짐 은 옮기다 전입 신고 를 하다 곳 이 없다 집 에 전세 로 오다 사람 에게 전입 신고 를 한 달뒤 에 하다 안되다 안되다 동거인 으로 내 가 들어가다 안되다 물어보다 여기 서 저 는 전세 로 가다 사람 이다 저 는 기금 든 들다 신혼부부 대출 로 전세 를 얻다 집주인 과 처음 부터 트러블 을 만들다 않다 그렇다고 손해 가 되다 조금 이라도 있다 계약 내용 은 아니다 거절 하고 싶다 어떤 방법 이 있다 당장 내일 이다,은행 에서 알 면 즉시 상환 요청 들어오다 년 만기 라면 은행 에서 연락 오다
부동산 전세 를 억천백 에 계약 을 년전 에 하다 이번 에 시세 가 억천 대로 낮추다 걸 보고 집주인 과 억천백 으로 재계약 하다 여기 서 천만원 을 계약 만 기다 돌리다 받다 하다 은행 에 대출 이 억천이 넘다 상황 이다 근데 재계약 후 확정 일자 받다 은행 전세 자금 대출 금리 가 저렴하다 년 정도 잠시 쓰다 계약 만 기 시 갚다 하다 문제 없다,청소 비용 및 전자레인지 렌트 비용 등 을 임대 인 에게 청구 하다 수 있다
제 가 원룸 전세 로 이다 하다 부동산 에서 이다 날 까지 청소 도 안 하다 하다 우리 가 오다 청소 하고 이다 하다 청소 비 빼다 하다 그래서 다시 전화하다 청소 비어 쩌실거 냐 하다 본인 한테 알다 되다 하다 이런 말 이 어딧는 지 계약서 에 써다 겁니다 아무리 보다 계약서 조항 에도 없다 풀 옵션 이라고 들어오다 전자렌지 도 없어지다 가다 주다 짜증 만 내다 소식 도 없다 제 가 전화 를 계속 하 니 건물 주랑 얘기 하라 며 이 게 말 이 되다 관리인 들 도 부르다 짜증 만 내다 도무지 여기 가 맘 에 안 들다 어쩌면 좋다,님 이 말 하다 모두 맞다
부모님 이 전세 계약 을 하다 하다 부동산 에서 보내다 안 내 물다 아래 와 같다 문구 가 있다 현재 근저당 건의 잔금 과 동시 에 전액 상환 말 소하 고 임차 인 이 순위 가 되다 해주다 혹시 이렇다 상황 전셋집 이 근저당 잡히다 물건 인 상황 에서 전 세금 을 납입 한 후 임대 인 이 계약 을 위반 하고 해당 집 으로 다시 근저당 을 잡다 되다 계약 위반 에 대한 손해 는 누구 에게 부동산 혹은 임대 인 어떻다 방식 으로 청구 를 하다 그리고 계약 위반 상황 을 예방 하다 위해 어떻다 조치 들 을 취할 수 있다 이렇게 근저당 잡히다 물건 을 전세 내놓다 경우 가 흔 한지 그리고 계약 을 하다 게 맞다 의견 부탁드리다,신축 아파트 의 경우 등기부 등본 이 나오다 시간 이 걸리다 수 있다 하지만 등기 소 에 방문 하다 등기부 등본 을 발급 받다 수 있다 등기부 등본 에는 부동산 의 소유자 지 분율 근저당권 등 과 같다 정보 가 기재 되어다 있다 공 동 명의 인 집주인 과 전세계약 을 하다 때 에는 계약서 작성 시 두 사람 모두 참석 하다 하다 계약서 에는 두 사람 의 인감 도 날인 하다 하다 특약 으로 걸다 하다 사항 은 다음 과 같다 전 세금 반환 보증 임대 인 의 의무 위반 시 손해배상 계약 해지 조건 기타 특약 사항 매 매가 가 피 가 붙다 더 오른 실정 이 므 로 전 세금 을 돌리다 받다 못 하다 위험 이 있다 따라서 계약 을 체결 하다 전 에 신중하다 검토 하다 하다 계약금 은 계약 이 성사 되다 않다 반환 하다 하다 따라서 가계약 금 을 지급 한 후 계약 이 성사 되다 않다 부동산 중개사 에게 가계약 금 을 반환 해달라다 요구 하다 수 있다
안녕하다 월세 말고 전세 는 처음 이고 억 단위 의 돈 을 빌리다 개인 에게 맡기다 것 도 불안하다 부덩산 전문가 분들 이 계시다 도움 좀 얻다 싶다 현재 집 을 보고 가계약 을 하다 상황 이다 다집 은 신축 아파트 로 년월 일 부터 집 을 볼 수 있다 이번 에 집 을 보고 전세 금도 일부 맞추다 계약 하다 마음먹다 제 가 계약 에 대해 좀 무지하다 상태 인데 부동산 직원 분 이 집주인 과 통화 후 가계약 금 을 입금 하 라고 하다 을 입금 하다 부동산 직원 분 이 부동산 공급 계약서 를 보여주다 때 매수 자 는 이다 제 가 입금 한 계좌 주인 은 이다 둘 은 공 동 명의 라고 하다 그냥 별 생각 없이 입금 하다 집 에 오다 또 전세 에 대해 이 것 저 것 알아보다 공 동 명의 로 되다 집 을 빌리다 찝찝하다 오다 공동 명의 인지도 모르다 임대차 계약금 수령 확인 서도 작성 하다 하다 지도 모르다 부동산 중개인 이 제 인적 사항 을 문자 로 받다 자기 가 작성 하다 확인 서 를 대필 하다 사진 으로만 보 내주다 지금 까지는 진행 되다 상황 이고 질문 사항 몇개 올리다 보다 ㅠㅠㅠ 신축 세대 이상 아파트 이고 등기부 등본 이 나오다 조금 오래 걸리다 들다 그렇다 오다 공 동 명의 인지 두 사람 의 지 분 이 얼마 인지 알 방법 은 없다 가요 부동산 직원 말 로는 두 사람 은 부부 라 함 공 동 명의 인 집주인 과 전세계약 을 하다 때 계약서 작성 시 두 사람 다 오다 오다 서다 무엇 을 특약 으로 걸다 하다 주의 사항 등 은 무엇 이 있다 전 세금 억천 이고 공급 계약서 보다 매매 금액 은 억 이다 지금 은 매매 가가 피 가 붙다 더 오른 실정 이고 부동산 직원 말 로는 근저당 융자 등 은 없다 하다 안심 하다 되다 매물 이다 요 현재 너무 무지하다 상태 로 가계약 금 을 지급 하다 단순하다 반환 해달라다 하다 때 반환 해주다 의무 가 있다 임대차 계약금 확인 서 를 부동산 직원 이 작성 하다 ㅠㅠ 저 는 그냥 그 자리 에서 입금 빨리 해주다 좋다 하다 무작정 입금 한 죄 는 있다 조언 및 답변 해주시 면 감사하다,전 세 임대 는 임대 인 동의 가 필수 인데 자다 해주다 않다 보통 계약금 걸다 법무사 측 에서 권리분석 하다 시간 이 제법 걸리다 기도 하다
부동산 전세 알아보다 보통 집 정보 올라오다 집 소개 하다 때 버팀목 대출 중기청 대출 가능 이렇다 글 들 이 자주 보이다 그런데 대출 불가능 이렇게 보이다 어제 부동산 에 전화하다 전세 임대 되다 문의 하다 저희 전 세 대출 이 자다 안되다 안 하고 있다 라고 하다 제 가 알기 로는 전 세 대출 과 전 세 임대 는 다르다 부동산 이 저 의 전세 임대 문의 를 전 세 대출 로 잘못 알아듣다 그렇게 말 하다 싶다 하다 뭔가 전세 임대 권리분석 조건 이 전 세 대출 이랑 비슷하다 동일 의미 로 말 한 건가 이렇다 생각 도 들다 부동산 쪽 은 자다 모르다 있다 전세 임대 되다 알아보다 있다 헷갈리다 두다 부동산 에서는 비슷하다 받아들이다 건가 요 조언 부탁드리다,기다리다 것 은 비추다 이다 근 생 은 보증 보험 기관 사 어떻다 곳 에서도 전 세 보증 보험 이 가입 되다 않다
오다 월 에 신탁 부동산 전세 계약 을 하다 계약 당시 부동산 을 통해 하다 부동산 주인 도 계약 당일 신탁 물건 을 확인 하다 하다 계약서 에 신탁 말소 를 조건 으로 하다 쓰다 계약 을 하다 임대 인 이 최종 계약 당일 말 소 시기 를 늦추다 달라 하다 전 세금 의 프로 만 먼저 주다 나머진 말 소 시점 에 주기 로 하다 그런데 그 시기 에 임대 인 이 오다 기간 을 올해 말 까지 늦추다 달라 고 하다 이건 인정 못 하다 계약 위반 이니 집 을 빼다 하다 알다 부동산 에 전세 를 내놓다 하다 그래서 이 거론 부족하다 안전 장치 를 해달라다 요구 하다 그러자 부동산 에서도 알다 하다 집주인 과 얘기 하다 일단 집 을 파다 하다 기다리다 있다 상태 이다 다그 과정 에서 알 게 되다 사실 은 이 집 이 근 린 종이 라는 겁니다 이대로 기다리다 괜찮다 전 세금 을 돌리다 받다 수 있다 방법 이 혹은 보장 받다 수 있다 방법 이 있다,전 세 임대 는 임대 인 동의 가 필수 인데 자다 해주다 않다 보통 계약금 걸다 법무사 측 에서 권리분석 하다 시간 이 제법 걸리다 기도 하다
부동산 전세 알아보다 보통 집 정보 올라오다 집 소개 하다 때 버팀목 대출 중기청 대출 가능 이렇다 글 들 이 자주 보이다 그런데 대출 불가능 이렇게 보이다 어제 부동산 에 전화하다 전세 임대 되다 문의 하다 저희 전 세 대출 이 자다 안되다 안 하고 있다 라고 하다 제 가 알기 로는 전 세 대출 과 전 세 임대 는 다르다 부동산 이 저 의 전세 임대 문의 를 전 세 대출 로 잘못 알아듣다 그렇게 말 하다 싶다 하다 뭔가 전세 임대 권리분석 조건 이 전 세 대출 이랑 비슷하다 동일 의미 로 말 한 건가 이렇다 생각 도 들다 부동산 쪽 은 자다 모르다 있다 전세 임대 되다 알아보다 있다 헷갈리다 두다 부동산 에서는 비슷하다 받아들이다 건가 요 조언 부탁드리다,전세 게 약 서 쌍방 합의 작성 확정 받다 고비 과세 아니다 양 도세 신고 거주지 세무서 에 하다 전 입신 고 안 하다 보퉁 직거래 이 면 쌍방 합의 법무사 불다 중개 비 없이 거래 신고 조건 으로 매매 로 소유권 이전 을 하다 법무사 도 디기 고맙다 하다
중개 서 없이 매수 자 와 직거래 를 하다 진행 중 이다 제 가 억 에 집 을 매도 하고 억천만원 에 전세 로 살기 로 하다 오늘 계약 하다 때 사용 하다 계약서 이다 계약서 상 문제 가 있다 부분 이 있다 특히 특약 에 저 부분 이 있다 전 세 계약서 를 또 쓸다 필요없다 계약금 천만원 을 받다 후 양 도세 및 부동산 거래 계 약 신고 를 하다 되다 가요 현재 전입 하다 살 고 있다 집 을 매매 하다 부분 인데 전입 신고 를 다시 하다 하나요 이 전 등기 는 매수 자 가 하다 부분 이니 신경안 써다 되다 가요,부동산 전세계약 서 작 성 주전 에 전세계약 하고 이사 를 하다 집주인 이 명의 를 아들 명의 로 바꾸다 싶다 계약서 를 다시 작성 하다 부동산 없이 그냥 작성 하다 하다 근데 저희 는 불안하다 부동산 통해 서 계약 을 하다 부동산 에서 작성 하다 수수료 나가다 그렇다 자기 들 은 그 수수료 내주다 생각 이 없다 이르다 경우 저희 사정 으로 계약서 를 다시 작성 하다 게 아니다 집주인 이 명의 변경 을 하다 계약서 를 작성 하다 건데 이 걸 저희 가 수수료 를 내다 게 맞다 그리고 집주인 이 요구 하다 부동산 안 끼 고 계약서 를 꼭 새롭다 작성 해주다 하나요 명확하다 임차 인 이 동의 하다 가능하다 부분 이니 필요하다 임대 인 이 비용 부담 하다 맞다 임대 인 이 거부 하다 임차 인 도 계약서 변경 거부 하다 방법 뿐이다
주전 에 전세계약 하고 이사 를 하다 집주인 이 명의 를 아들 명의 로 바꾸다 싶다 계약서 를 다시 작성 하다 부동산 없이 그냥 작성 하다 하다 근데 저희 는 불안하다 부동산 통해 서 계약 을 하다 부동산 에서 작성 하다 수수료 나가다 그렇다 자기 들 은 그 수수료 내주다 생각 이 없다 이르다 경우 저희 사정 으로 계약서 를 다시 작성 하다 게 아니다 집주인 이 명의 변경 을 하다 계약서 를 작성 하다 건데 이 걸 저희 가 수수료 를 내다 게 맞다 그리고 집주인 이 요구 하다 부동산 안 끼 고 계약서 를 꼭 새롭다 작성 해주다 하나요,임대 인 분과 협의 하다 나름 이다 다만 이 에 수긍 해주다 임대 인 이 현실 적 으로 극히 드물다 사실 이다
안녕하다 아파트 대출 프로 제 돈 프로 로 전세 로 살다 전 직장 에서 그만 두다 일 을 아직 구 하다 못 하다 전 세 이자 랑 카드 대금 을 달 못 내다 상황 인데 매매 계약 자 한테 제 돈 프로 중 에 일부 를 받다 갚다 드리다 되다,통상 최초 의 년 계약서 만 중개업 소 에서 쓰다 되다 것 이고 갱신 재계약 을 하다 때 는 두 분 이 계약서 사 다가 써다 되다 것 이지 요
집주인 이 구매 한 가격 은 억 저 는 전세 가 억 에 살다 년전 에 부동산 에서 계약 한 걸 이번 에 재계약 하다 현재 등기부 등본 에는 대출 은 없다 뜨다 전 세금 억 중 에 천은 은행 대출 이다 은행 에서 재계약 은 부동산 에서 쓸다 계약서 아니다 괜찮다 다해 서 집주인 이랑 직접 계약서 년 으로 쓰다 하다 괜찮다 자세하다 설명 부탁드리다,전세기 간 만료 되어다 전 세금 반 환시 세 입자 가 아니다 대출 은행 에 반환 하다 하다 이 것 만 지키다 신다 크게 문제 되다 것 은 없다
몇 일전 에 부동산 전세계약 을 하다 저 는 임대 인 이다 저 는 제 가 살 고 있다 아파트 를 전세 를 내놓다 들어오다 세 입자 가 있다 하다 전세계약 을 하다 되어다 그런데 계약서 쓰다 계약금 을 받다 날 특약 에 임대 인 이 전 세 자금 대출 과 전세 보증금 반환 보증 보험 에 협조 및 동의 한 다라 고 기재 가 되어다 들어오다 사람 이 전 세 자금 대출 을 받다 것 을 계약 날 알 게 되어다 처음 으로 임대 인 이 되다 전세 자금 대출 받다 저 임대 인 아무 상관없다 생각 하다 그냥 넘어가다 나중 에 알 고 보다 질권 설정 어리다 임대 인 이 주의 하다 보이다 아니다 중개인 이 미리 사전 에 들어오다 사람 이 전세 자금 대출 받다 저 한테 설명 하고 계약 날 특약 으로 넣다 야하다 않다 원래 중개사 들 은 이런 가요 전세 대출 받다 미리 저 한테 사전 에 말 하다 계약 하다 안 하다 결정 하다 하다 아니다 계약 하 는 당일 날 특약 으로 임대 인 은 전 세 자금 대출 에 협조 및 동의 한 다라 고 넣다 중개사 가 계약서 에 이의 없다 라고 끝나다 당일 날 전 세 자금 대출 제도 가 뭔 지 모르다 뭣모르 고 동의 하다 나중 에 인터넷 검색 하다 질권 설정 및 채권양도 라 심하다 부담 되다 제 가 직접 은행 에 보증금 을 반환 하다 문제 또는 나중 에 매도 하다 하다 때 매 수인 의 심 적 부담 등등,년월 이전 계약서 를 작성 하다 만 기전 개월 까지 재계약 여부 를 통보 하다 수 있다 중요하다 사항 이니 전화 로 하다 좋다 것 같다 문자 도 안되다 것 은 없다 만요 임대 인분 께 계약해지 를 말씀드리다 새로이 알아보다 집 이 예상 하다 로는 기존 주택 의 전세 만기 이후 일 듯 하다 임대 인과 전 세 대출 은행 에 사정 을 이야기 하다 일단 연장 처리 하다 새롭다 집 에 이 사가 는 날 기존 주택 의 전세 보증금 을 받다 전 세 대출 도 상환 하다 되다 법 으로야 지금 통보 하다 상관 이 없다 분명 만기 가 얼마 남지 않다 급하다 사실 이다 임대 인 분쪽 에 여유 있다 준비 하다 자다 협조 부탁 하다 그래서 좋다 관계 속 에서 임대차 계약 을 종료 하다 것 을 권유 드리다
