,구분,질문,답변
491,전세,제가 이사갈 집을 네이버 부동산은로 알아보는중인데 주변 다 5평 원룸이 전세 1억정도 하는데좀전에 본 집은 전세 3천200에 10평짜리고방도 두개에 신축 첫 입주하는 집이더라고요아무리 봐도 주변 전세1억인 집들보다 수배는 좋은데너무 싸서 의심되네요,"우선 4억의 전세보증금으로 1억에 전세자금대출 받으시는건 문제가 없습니다.​부모님도 3억이라는 현금이 증여냐 차용이냐에 따라서 증여세 또는 대출이자 납부등으로 나뉠 수 있습니다.​전세보증금 반환시 부모님돈을 돌려드린다면 이건 차용이 됩니다.하지만 부모 자식간이라도 차용증 작성 및 이자를 납부해야 합니다.거래계좌로 증빙될 수 있도록..​전세보증금 계약금, 잔금은 모두 질문자님 계약자가 임대인에게 입금하셔야 합니다.​편법이 있지만, 공개된 장소라서 원칙만 말씀 드립니다."
492,전세,"안녕하세요? 바쁘신 와중에 질문 봐주셔서 감사합니다. 금번 부동산 전세 (오피스텔) 로 입주를 알아보고 있는데,보증금 약 4억에서 일부 금액 (약 3억원)을 부모님께서 도와주시고,그 외 1억정도를 제 명의로 조달할까 알아보고 있습니다.이 상황에서 혹시 제 명의로 전세자금대출을 1억원만 일으켜서 진행하려 하는데,향후 법적인 이슈나 금융거래 상 큰 문제점이 있을까요?(3억 현금 - 부모님 / 1억 - 제 명의 전세자금대출 = 총 4억 전세보증금 진행)은행에 가서 직접 알아보려 하고 있으나, 일반적인 현황을 고수님들께 여쭙니다.좋은 하루 되세요",집주인과  상의해서  당길  수도  있고  미룰 수도 있습니다.​무조건  만기일에 나가야 하는  것은  아닙니다.
493,전세,안녕하세요23.09.28 부동산 전세 계약 마감일인데 09.28~10.03일까지 쉬는날입니다보통이런경우 법적으로 하루전날인 27일이 전세 마감일인가요? 10/03일이 마감일인가요?아니면 상관없이 28일이 마감일인가요?,그렇지않습니다.특약에기재한 안심전세대출에한한것이므로  부동산에서 협동조함대출은 해당되지 않습니다. 부동산에서 권유하는것은 금리가높은데 할이유가 없는것입니다.자꾸강요하면 등록관청 부동산관리팀에 신고한다고하면 되고 ..그래도한다먄 신고하세요 부동산의 신의성실의의무가있는데 공인중개사라는사람이 어찌고객이 불리한데 지기욕심만차리는지한심스럽습니다.
494,전세,"먼저 본인은 임차인입니다. 현재 부동산 전세계약을 진행하였고 대출 과정에서 부동산의 중개로 특정 금융기관 이용을 강요받고 있습니다.아래 계약의 특약 사항입니다.- 위 부동산은 현재 매매계약 진행중임을 확인함 (매매계약서 첨부)- 임차인은 직접 방문하여 현시설물 상태인지하고 진행하는 계약임 (등기사항전부증명서 첨부)- 임대인은 임차인의 대항력 및 확정일자 권리를 갖추기 전까지 일체 추가적으로 권리 설정변동이 없어야 한다. 설정 시 본 계약은 소급하여 무효로 하고 수령된금액을 전부 임차인에게 즉시 반환하기로 한다.- 임대인은 임차인의 HUG안심전세자금대출 및 HUG전세금반환보증보험 적극 협조하기로 하며 또한 임차인도 금융기관의 자서일정에 차질 없이 적극 협조 해야한다.- HUG안심전세자금대출 및 HUG전세금반환보증보험이 임대인의 사유 및 목적물의 하자로 인해 가입 불가시 본 계약은 소급하여 무효로 하며, 수령받은금액을 임차인에게 즉시 전부 반환하기로 한다. 단 임차인 귀책사유(신용도하락, 대출부결을 위한 고의적 행동, 단순변심 등)인 경우 제외한다.- 계약기간 만기전 퇴실시 중개보수료는 임차인이 부담하고, 다음 임차인을 구한다.- 관리비 및 기타공과금 정산은 잔금일에 임대인이 정산하기로 한다.- 현 시설물을 임차인의 고의나 실수로 파손시 임차인이 배상하기로 한다. 임대차 기간 만료로 퇴거시에도 동일하다. 단 중대한 하자는 임대인측에서 수리하기로 한다.- 임차인은 계약만기일 3개월전에 재계약여부 또는 미리 계약해지를 임대인에게 통보한다. 미통보시 자동연장이 될수 있음(문자, 내용 증명 등)- 잔금일은 은행 대출 승인 여부나 상호간의 협의에 따라 변경될 수 있음을 확인한다.- 계약금 및 중도금, 잔금은 임대인 계좌 로 이체키로 한다.현재 부동산에서는 특정 협동조합 금융기관에서 대출을 받을 것을 요구하고 있습니다.다만 해당 금융기관의 금리가 지나치게 높아 금리우대등 이자율이 적정한 1금융권에서 대출을 받겠다고 하였으나, 해당 금융기관에서 대출이 나오지 않는 경우 무조건 자신들이 지정한 금융기관을 이용해야 한다고 합니다.원하는 금융기관에서 대출이 나오지 않더라도 부동산이 중개한 은행에서 대출이 가능하다면 계약 파기로 인한 계약금 반환이 어려운지 문의 드립니다.감사합니다.",요즘 워낙 전세사기가 많아서 ㅠㅠ 기왕이면 조심스럽게 진행하시는게 좋겠어요
495,전세,실거래 2억 8천 정도고 전세가 2억에 나왔는데 융자가 1억 8천이 있네요근데 집주인이 계약하고 돈받으면 융자 6천을 상환한다고 하는데 계약을 해도 괜찮을까요?보증보험 가입도 될까요? ㅠ 요즘 무서워요ㅠ 부동산 잘알아봐야하는데 아는게 없어 여기에 올려봅니다ㅠ,"전세계약 시 보증금은 계약 당사자 간 협의에 따라 결정되는 것이 일반적입니다. 일반적으로 부동산 중개업소는 보증금을 받지 않습니다. 하지만 일부 부동산 중개업소에서는 보증금을 받을 수 있습니다. 이 경우 부동산 중개업소에서 정한 기준에 따라 보증금을 지불해야 합니다.​또한, 계약서 작성 시 계약 당사자 간 협의에 따라 계약금과 보증금을 어떻게 지불할 것인지를 기재합니다. 이 경우, 계약서 내용을 준수해야 합니다.​이전에 언급한 것처럼, 대출을 받기 위해 계약서 상 최소 5%가 아니더라도 부동산 측에서 추가적인 금액을 요구하는 것은 법적인 절차가 아니라면 부당한 요구일 수 있습니다. 따라서 이 부분에 대해 부동산 측과 협의를 더 해보는 것이 좋을 것입니다."
496,전세,"지금 살고있는집은 22.7월에 2년전세계약했던 오피스텔이고, 개인적인 사정이 있어서 부동산에 복비 50주고 다른집으로 이사를 가야하는 입장입니다.(전세대출받았습니다)괜찮은 빌라가 있어서 그쪽으로 이사를 가려 하는 상황입니다가계약금 100만원 넣었구요.이사갈 빌라 보증금도 마찬가지로 전세대출 받았던 은행에서 대출 받을 예정입니다.근데 이사갈집 전체 보증금의 최소 5프로는 드려야 계약서가 나오고, 그 계약서로 전세대출을 받을 수 있다고 하셔서은행가서 확인받으니 계약서 작성할때 보증금의 5프로가 굳이 아니어도 대출금 나온다 하시더라구요그래서 이부분은 부동산측이랑 협의를 봤고, 제가 보냈던 가계약금 100만원만 해서 계약서를 받아내 대출 받을예정이에요그런데 부동산에서 400만원을 더 달라고 합니다. 지금 빌라에 살고있는 세입자한테 500만원은 드려야한다고....애초에 이런이야기는 없었는데 너무 당황스럽고... 원래 이게 법적으로 절차인건가요︖대출받기위해 계약서상 최소 5%때문도 아니고, 현재 빌라에 살고있는 세입자한테 500줘야하니 400 더줘야한다니....궁금합니다. 답변부탁드려요","​안녕하세요.​귀하의 질문에 답변드리겠습니다.​먼저, 임대보증금 미가입에 대한 동의서에 대해서 말씀드리겠습니다. 임대보증금 미가입은 주택임대차보호법 제49조제7항에 따라 임차인의 동의가 있는 경우 가능합니다. 임대사업자의 재산 상태가 양호하고, 임대보증금이 주택임대차보호법상 최우선변제금액 이하인 경우 임차인은 임대보증금 미가입에 동의할 수 있습니다.​귀하의 경우, 임대사업자가 임대보증금 미가입에 동의하도록 체크를 해두셨고, 근저당이 잡혀 있지 않은 것으로 보아 임대보증금 미가입이 가능할 것으로 보입니다. 다만, 임대보증금 미가입에 따른 위험을 충분히 이해하고 동의하시는 것이 좋습니다. 임대보증금 미가입으로 인해 임대사업자가 임대보증금을 돌려주지 못할 경우, 임차인은 소송을 통해 임대보증금을 돌려받을 수 있지만, 소송이 장기화될 수 있고, 승소하더라도 보증에 가입된 금액만 돌려받을 수 있기 때문입니다.​다음으로, 계약일자에 대해서 말씀드리겠습니다. 계약일자는 임대차계약이 체결된 날을 의미합니다. 임대차계약은 임대주택의 인도와 동시에 성립되므로, 임대차계약서를 작성하는 날과 계약일자는 동일합니다. 귀하의 경우, 10월 29일이 계약종료일인데 8월 21일자로 계약일을 기재하신 것으로 보입니다. 이는 임대차계약이 8월 21일에 체결된 것으로 해석될 수 있습니다.​임대차계약의 계약일자는 임대차 계약의 종료일, 보증금 반환, 전입신고, 확정일자 등과 관련이 있으므로, 정확하게 기재하는 것이 좋습니다. 따라서, 귀하의 경우, 임대차계약의 계약일을 10월 29일로 기재하는 것이 바람직합니다.​결론적으로, 귀하의 경우, 임대보증금 미가입에 대한 동의서에 동의하실지 여부는 신중하게 결정하시기 바랍니다. 또한, 계약일자는 10월 29일로 기재하는 것이 바람직합니다.​귀하의 결정에 도움이 되기를 바랍니다."
497,전세,"안녕하세요 부동산을 안끼고 연장 계약을 하려고하니 궁금한 사항이 있어서 지식인에 문의드립니다우선 집주인분은 임대사업자분이시고, 오늘날짜 기준으로 근저당잡힌 내용은 없습니다.10월에 전세계약이 종료되어, 집주인이 연장여부를 물어봤고 연장을 하겠다고 하여 보증금 1500만원을추가로 주기로 했습니다. 표준임대차계약서 1부임대보증금 일부보증에 대한 임차인 동의서 1부이렇게 총 2부를 보내주셨는데 임대보증금 미가입에 동의하라고 체크를 해주셨더라구요내용을 보니 추후 임대사업자로부터 임대보증금을 돌려받지 못할 경우 보증에 가입된 일부 금액만 보증회사에서 지급이 가능하다는데 이 모든걸 제가 동의 해야할까요?그리고 10월 29일이 계약종료일인데 갱신 계약서 계약일은 23년도 8월 21일인데 싸인해서 보내줘도상관없을까요?괜시리 불안한 마음에 문의드려봅니다자세한 답변 부탁드립니다감사합니다",[답변]LH전세임대로 들어갔으면 실제로 질문자님의 보증금이 들어간 금액은 100만원-200만원이겠네요.​가압류 걸려있고 향후 경매에 넘어가면 LH에서 배당신청하여 낙찰받으면 보증금을 반환받은 뒤 임차인분에게 돌려드릴 수도 있습니다.​그리고 LH 공문에는 등기상 가압류 등 변경이 있을 경우 LH공사에 직접 전화해서 안내하라고 되어 있습니다. LH에 전화해서 해당 사실 알리고 향후 조치 어떻게 하는지 물어보세요
498,전세,현재 집을 전세 LH로 20년5월에 들어갔습니다. 그리고 재계약시 구두로만 얘기를 한상태인데 첫계약시 확정일자 받고재계약시는 하지않은상태입니다.냉장고문제로 집주인에게 문자를 보낸지 2주째인데 연락이 되지않아현재 등기부등본을 때보니 가압류가 많이 걸려있습니다.전세금 받을수있나요??부동산 신님 도와주세요ㅠㅠㅠ앞으로 제가 해야할일은 무엇인가요?ㅠㅠㅠ도와주세요,"우리 나라 계약은 낙성 불요식 계약이 원칙입니다 의사의 합치만 되면 계약은 성립합니다. 종이서류로 남기는 것은 나중에 분쟁에 대비하기 위해서 입니다. 의사의 합치 어짜피 합치된 내용 종이 서류에 다 표현 못 합니다. 계약 장면  동영상으로 촬영중임을 크게 잘보이게 알린다음 동영상촬영 상대와 참석한 사람들 동의를 얻어 계약 장면 촬영해 놓으면 분쟁에서 좋은 증거자료가 되지만, 촬영에 거부하는 사람등 다른 사람들이 촬영될경우 통신비밀 보호법 위반 문제가 생길수 있어요"
499,전세,"23년 4월 이전 부동산 전세 계약 예정이며 부동산을 통해 임대인에게 국세납세증명서랑 지방세납세증명서를 발급 요청하려고 예정 중에 있습니다.보증금 방어를 위해 확인하려는 목적이며이 내용에 궁금한 것이 있습니다.1. 임차인의 부동산(보증금)에 영향을 미치는 건 국세/지방세 중 어떤 것인가요? 둘다인가요?(계약시 어떤 납세증명서를 미리 받을지 확인하기 위함)2. 계약금을 치룬 뒤에 임대인의 체납(미납)이 새로 발생된 경우, 임차인의 보증금이 1순위에서 밀려나나요?3. 잔금을 치룬 뒤에 임대인의 체납(미납)이 새로 발생된 경우, 임차인의 보증금이 1순위에서 밀려나나요?각 항목에 대해 답변 부탁드립니다.","국세만 영향을 줍니다. 확정일자보다 빠른 국세(신고일, 고지서 발송일)는 먼저 배당 되고,  확정일자보다 늦은 세금은 보증금이 먼저 배당 됩니다."
500,전세,"현재 아파트 전세 1.3억 보증금으로 4년(임차갱신권사용) 거주가 다음달에 만료될예정입니다. 현재 대출은 중기청전세대출 1억있는 상태이구요.지난주 신규계약으로 시세반영하여 2.5억으로 보증금을 증액하였는데, 중기청 전세대출은 이제 조건이 안되어 제 돈으로 1억원 대출상환을 하고 타은행에서 전세대출을 신규로 하려고 하는데요. 동일 임대인, 동일 목적물일경우에는 재계약? 으로 간주되어 기존 보증금에서 증액분만 대출이 된다는 말을 들었는데 기존 은행 중기청 대출을 제 돈으로 상환하고 타 은행에서 대출을 할때도 이 조항이 적용되나요? (LTV80% 적용하여 2억원 대출하고자 합니다)","전세계약중에 나가도 되는지기본적으로 2년 계약 하고 들어간건데, 그걸 위반하는겁니다.하지만 나갈 순 있습니다.새로운 세입자를 구하던가(구해지면 전세금 받을 수 있음), 아니면 실거주를 안하는 방법(전세금은 2년 계약 만료되면 받음)입니다.​2. 원래 전세금을 바로못받으면 어떻게해야되는지  계약기간 전에 나가는거기 때문에 새로운 세입자가 없다면 임대인도 방법이 없습니다.임대인이 돈이 많아서 전세금을 미리 주고, 공실로 두면 좋겠지만, 계약위반하는 세입자를 위해 그렇게까지 해주는 착한임대인...은 없을겁니다.3.당장 5월말까지는 나가야 수술진행이되고 간호를받을수가있는데  빨리 나갈수있는방법이있는지 궁금합니다새로운 사람이 오는걸 기다리거나, 더 많은 부동산에 광고?를 올리던가, 본인이 직접 새로운 세입자를 구하는게 최선입니다.그게 아니면 그 집은 공실로 두고 전세금은 계약 만료전에 받으셔야겠지요.​​"
501,전세,부동산쪽으로 궁금한게 있습니다제가 올해 11월에 전세계약이 끝나는데  대장쪽으로 쫌안좋아서 대장수술이 크게 올해말에있는데 이건으로 친척이있는곳 근처에 이사를하여 수술후 간호를받아야되는 상황이라 처음에 계약한 부동산과 집주인께 상황을 말씀드렸고집주인은 당장 전세금이없다 세입자가 오면 그전세금을 주겠다고했습니다 지인부동산들도 일단 구해주는중이고제가 궁금한게 1.전세계약중에 나가도 되는지2. 원래 전세금을 바로못받으면 어떻게해야되는지 3.당장 5월말까지는 나가야 수술진행이되고 간호를받을수가있는데  빨리 나갈수있는방법이있는지 궁금합니다,계약서 를 미리 작성 해도 되고 재계약되도 확정일자를 다시 받으면 후순위로 밀려나니 다시 받으면 안되지만 보증금 증액일때 는 증액분만 수정 확인 받으면 선순위가 유지됩니다
502,전세,"집주인도 변경되었고 보증금도 증액하여 부동산 전세 연장 계약을 하려고 하는데요. 현재 계약 만료까지 3개월 넘게 남았는데, 계약서를 먼저 작성해도 될까요? 그리고 계약서 작성한 날 확정 일자를 꼭 받아야 하나요? 아님 확정 일자를 천천히 받아도 되나요? 전입 신고는 2년전부터 이미 되어 있습니다!","전세를 받을 수 있는 방법이 없다면, 전세계약서를 다시 작성하는 것이 좋습니다. 이전에 작성한 계약서와 동일하게 작성하면 되며, 전세금 영수증 등은 따로 챙겨야 합니다."
503,전세,지금 전세3000하고 원룸에서 살고 있는데 몇년이 지나갔어요 요새 집주인이 바꾸면서 제가 전세를 뺄려구 했는데 집주인이 돈이 없다네요 마냥 기다가는것도 그래서 혹시나 무슨 방법이 없을까요 ?전세 받을수 있는 방법 없으면 전세계약서 다시 쓸 생각인데 전에 쓴 계약서는 그때 관리사무실이랑 체결해서 시간이 좀 지났어요 다시 계약을 하면 그냥 전세계약서 를 작성하면 되나요?전에 쓴 계약서 동일하게 작성하면 되나요?따로 머 전세금 영수증머 이런거또 챙겨야 되나요 ?,"증거가 명확하다면 실제 손해본금액이 있을경우손해배상 청구는 가능할수 있습니다 민법 제623조에 의하여 임대인이 임대차목적물을 사용할수 있게끔 보수해 주지 않을경우 가능은 하지만 위 경우는 보수를 해주고 있으므로 가능하지 않아 보입니다다만 아직도 보수가 덜된부분에 대해서는 내용증명에명시하여 통보후 안해줄경우 임대차분쟁조정신청을한후 그 결과에 따라 법적인 대응을 해볼수 있습니다​질문 : 3. 공인중개사를 확인설명의무 위반으로 걸고(소액으로손해배상) 승소할시 그결과를 가지고 임대인에게 계약 파기를 거는 방법도 가능한가요? ​답변 : 공인중개사를 상대로 손해배상 청구를 하여승소를 한다 하더라도 그 판결문이 임대인과의 계약파기에 문제삼기는 힘듭니다​민법 제623조""임대인은 목적물(임대차 건물)을 임차인에게 인도하고계약존속중 그사용,수익에 필요한 상태를 유지하게 할의무를 부담한다.""라고 규정 하고 있습니다계약기간 존속기간 동안 임차인이 고의나 과실 관리부실로 문제가 발생한것이 아니라면 임대인은 목적물을 사용,수익 할수 있도록 유지,수선할 의무가 있습니다​대법원 판례(대법원 94. 12. 9 선고 94다 34692 94다 34708 판결)세입자가 사용할수 있도록 해 주지않아 피해가 발생되면 손해배상을 하게끔 판결 났습니다        "
504,전세,"* 부동산의 표시: * ﻿﻿임대차예정금액:* ﻿﻿가계약금 :* ﻿﻿본계약체결일 :* ﻿﻿임대인 계좌번호 :* ﻿﻿거래약정내용 :가. 다른 약정이 없는 한 임대인은 가계약금의 배액을 상환하고, 임차인은 가계약금을 포기하고 계약을 해제할 수 있고, 가계약금 송금 후 임대인,임차인 어느 한쪽이 본계약을 불이행하는 경우는 가계약금을 위약금으로 본다.나. 가계약 거래약정내용의 효력은 가계약금 송금일로부터 본계약이 체결될 때까지 유효하다.다. 본 가계약은 임대인/임차인에게 위 부과 조건이 기록된 본 가계약내용의 문자를 핸드폰으로 발신하여 동의를 받고, 가계약금은 온라인 송금한다.","대항력이 없다면 전 세입자분들이 강제로 방을 빼야 하는 것은 맞습니다.대항력 있는지, 없는지는 등기부, 매각물건명세서와 같은 서류로 확인할 수 있습니다.부동산을 통해서 확인해 보시면 알 수 있습니다. 근저당 없고 권리에 문제 없다면 대출도 가능합니다.​​"
505,전세,등기부를 확인해보니 작년에 경매로 되있었고 새입자들이 강제로 방을 빼야한다며 물어보니그집을 2년에 5%씩 올릴수있는데 다른사람이 매매해서전세값이 올라 전세입자분들이 강제로방을빼야한다고 했습니다그리고 부천에있는 부동산에서 안산까지 거래하셨던것도 이상했습니다동시진행을 한다며승계확인서를 쓴다고 주민번호를 물어봤습니다 카뱅으로 한다고했는데이집을 전세계약해도 되는걸까요?,세입자 대체한후 보증금 반환해주면 됩니다.전세를 연장할시 동일조건이라면 계약서 작성 하지 않아도 되고정 작성하고 싶다면 대필료만 부담하시면 되구요
506,전세,안녕하세요 오피스텔 2년 전세를 내줬는데 세입자가 계약만료 2달전에 연락이와서 1년 연장을 희망하여 그렇게 하라구 이야기를하고   전세금 5% 인상  이야기를하니 생각을좀 해보구 이야기해준다고 말을해서 기다렸습니다 이후에 할거처럼 이야기가 되어서 계약했던 부동산이랑 말을 마쳐놓고 기다리고있었는데 계약기간 만료가되었는데 이제와서 연장을 안한다고 이야기를하네요제가 목돈이 묶여있어서 전세금을 다음 세입자를 구해서 내줘야하는데 이런경우에는 다음 세입자 구할떄까지 기다리게할수있는건가요? 추가로 궁금한사항 전세금 바로  못줄경우에 경매로 넘어가는건지 전세 연장하게될경우 계약서를 써야하며 복비를 지급해야하는지,만기전에 나가시는건 계약위반이므로 집주인한테 그만큼의 보상을 해주셔야 한다고 생각합니다.​부동산 계약서에도 2년을 채운다고 하셨는데 급한 사정 때문에 나가시는 건 계약위반이니까요.​예를 들어서 남은 계약기간이 6개월 남았으면 6개월만큼의 월세를 준다던가 하셔야 할 거 같아요.
