,구분,질문,답변
679,월세,안녕하세요 부동산월세 계약서 질문드립니다. 제가 2019년부터 21년까지 월세 계약기간인데그후에 계약서를 쓰지않고 자동연장이 되어  23년까지 월세를 납부하면서 거주를 했습니다.그런데 연말 정산때 계약서상의 임차인이 제 명의가 아니라 알고보니 저희 어머니 명의셨더라구요그래서 이번에 계약서를 다시 써야하는 상황인데 궁금한점이 부동산월세 원룸 계약서는 인터넷에 보니 양식이 많이 있던데 꼭 부동산을 거치지 않고 집주인과 개인적으로 월세 계약서를 다시 쓸수있는지 궁금합니다. 그리고 계약서를 다시 쓴다면 제가 처음 거주한 19년과 21년 계약서를 다시 쓸수있는지도 궁금합니다.,​계약서를 소급작성하는 것은 예전에 주택임대차신고를 했다면 신고서 변경은 쉽지 않을 것 같네요.  그 문제만 아니라면 임대인의 승락이 있고 월세 계좌 이체를 고객님이 하셨다면 가능할 수도 있겠네요. 하지만 연말정산에서 월세 세액공제를 위한 계약서로 활용된다면  연말정산 담당자의 인정여부가 관건이 될 수 있습니다. 근본적으로 계약서를 소급한다는 것은 바람직한 것은 아니니까요.
680,월세,부동산( 월세 ) 동일조건 연장시 계약서 재작성해야하는건가요?기간만료전에 전화 및 문자로 동일조건 연장 합의해서 기일이 몇달경과되었는데 임대인께서 계약서 작성이 필수 였다며 부동산에 가서 재 계약서 작성하자고 하는데요 제 생각에는 동일조건이니 재연장계약서가 필요없을것 같고 필요하다면 기존계약서 특약부분에 해당사항만 추가기재 정도만 하면 될것 같은데 관련법에 대하여 알고 싶습니다.제가 우려하는 부분은 계약서 변경시 확정일자 관련한 우선순위 변경입니다(확정일자 따로 안받아도 되는건지요?)임대인 전담 부동산에서는 계약서를 써야한다고 했고 5만원씩 내야한다고 했다고 합니다.,기존 계약서 특약란에 기간 갱신의 내용을 기록해도 되지만 기간 갱신 재계약서를 써서 거기에 확정일자를 받는다고 해도 동일 주택의 경우라면 순위가 밀릴 일은 없는 것이지요.
681,월세,"제가 청년 월세지원을 받아야 하는데, 저한테는 부동산 월세계약서라고 적인 이 종이만 있는데, 동일한 건가요?이 종이에 부동산, 집주인,저의 도장과해당 동사무소의 확정일자 도장까지 한장에 다 찍혀있습니다.",같은 겁니다 걱정않으셔도 됩니다
682,월세,"부동산 보증금500/월세 35 계약햇습니다.계약금으로 50만원 집주인에게 드렷고,입주하는날 나머지 보증금과 부동산중개비 지급할 예정이였습니다.계약금 주고 일주일 후 방에 바닥에서 물이 차 올라 바닥보수 문제로 입주가 힘들것 같다고 연락이왔습니다.그렇다면 저는 계약금 배액으로 보상 받을수 있나요?배액으로 보상받길 원하는대 집주인은 그렇게 주길 꺼려하고 있고, 혹여나 그럼 그냥 들어와 살아라 라고 할수도 있을것 같아서 걱정입니다.질문요약1.배액배상이 받을수 있나요?(집주인 개인사정이 아니라 방 보수 문제라 솔직하게 저에게 말하고 다른방 구하라고 해서요)2.아직 부동산 중개비는 내지 않은상황인대 중개비도 내야하나요??",임대인측의 하자로 인한 계약의 파기이므로 배액을 청구 할 수가 있지요.아직 중개행위가 한참이나 남았으므로 반정도만 주어도 되겟지요.
683,월세,"아파트 월세 100만원으로 2년 계약했습니다. 계약종료일자 2023.12.31 이라 1년 연장계약을 임대인에게 요구했습니다.임대인이 월세 5%인상하여 105만원에 계약하자고합니다.이때, 법적으로 임대인이 105만원을 요구할수있는건지 궁금합니다.혹여나 임대인 동의없이 100만원으로 최대 3년까지 계약을 연장할수있는것은 아닐까 궁금해서요.",5% 인상은 가능합니다.3년까지 그대로 월세를 줘야 하는 것은 전혀 아닙니다.2년 계약했어도 1년 지나면 5% 올려 달라고 했습니다.오히려 임대인이 올릴 수 있다는 것을 모르고 지금 올리는 것입니다.
684,월세,"월세 계약 후 계약생신청구권도 사용하고 4년이 지났습니다. 월세를 증액하여 그대로 거주하기로 하였는데,새롭게 월세계약서를 작성하고 증액한 금액을 적을 때그냥 금액만 적으면 되나요아니면 ""월세를 증액하였다"" 라는 항목을 적고금액을 적어야 하나요?적지 않아도 된다면 그냥 증액된 금액을 적고 계약서를 작성하려 합니다",전과 동일하게 계약서를 쓰시고 월세 부분만 증액된 금액으로 바꾸면 됩니다. 그리고 특약 사항에 4년 거주후 계약의 연장이라고 적어 두시면 참고가 됩니다. ​보증금은 동일 하기 때문에 다시 확정일자는 받지 않으셔도 되면 이전 계약서는 반드시 보관 하시기 바랍니다
685,월세,"안녕하세요 월세 계약을 하려고 하는데 신탁이 되어있는 집이더라구요 특약사항 보니까""본계약은 신탁등기된 물건으로써 수탁자(신탁자)와 상관없이 위탁자(소유주)인임대인은 해당 물건 임대차에 모든 책임을 지기로 한다""이렇게 적혀있던데 이런경우 임대인이랑 직접 계약을 체결해도 괜찮은 부분인가요?! 이러한 경우도 임대차계약승낙서를 요구해야 할까요?!!","​신탁등기된 부동산은 그렇지 않은 부동산보다 권리관계가 복잡한 편이기 때문이 임대차 계약을 체결하실 때 각별한 주의를 기울이셔야 합니다. 일반적인 임대차 계약 관계는 임대인, 임차인이 당사자가 되는데, 신탁등기가 설정된 임대차 계약의 경우에는 위탁자, 수탁자, 수익자, 임차인이 당사자가 됩니다. 수탁자(일반적으로 신탁회사)가 아닌 위탁자와 임대차 계약을 체결하면 임대차 계약의 효력 자체가 부정될 수 있습니다. ​이 경우 당연히 우선변제권이나 최우선변제권을 주장할 수 없습니다. 보통 신탁회사의 동의를 받는데 신탁회사의 동의를 받는다고 해서 보증금이 보호되는 것은 아닙니다. 최근 신탁등기를 악용한 전세사기가 기승을 부리고 있는데 이에 해당사항이 없는지 검토해보시는 것도 필요해보입니다. "
686,월세,안녕하세요 궁금한게 있어서 글을 올립니다.월세를 처음에 1년계약을 했고 23.6.25 만기입니다. 저는 임대인이구요계약 한달전에 월세계약집을 빼달라고 통보를 하였는데 주변인 말로는 임차인이 1년 연장 요청하면 2년까지는 자동연장을 할수있다고 들었습니다.개인적으로 가족이 그집을 들어가게 되는 상황이 되서 혹시 부동산법이 궁금해서 문의 드립니다.궁금한건1.가족이 들어가게되는경우 자동연장 1년이 적용되는지2.만약 안된다고하고 일방적으로 나가라고 통보를 한다면 중계비랑 이사비용까지 내줘야하는지 문의드립니다,"월세 계약서에 자동 연장 조항이 명시되어 있으면 임차인이 1년 연장을 요청하지 않아도 자동으로 1년 연장될 수 있습니다. 하지만 이는 계약서에서 명시되어야 하며, 일반적으로는 자동 연장이 적용되지 않습니다. 만약 부동산 회사나 집주인이 1년 연장을 원한다면, 임차인과 협의하여 새로운 계약서를 작성하여 계약을 연장할 수 있습니다. 만약 계약 만료일이 다가오면서 중개인에게 월세 계약서를 제출하지 않았다면, 일방적으로 계약을 종료하여 나가라고 요구할 수 있습니다. 그러나, 계약이 종료될 때 중개인에게 중개 수수료를 지불하여야 하는 경우가 있습니다. 계약서나 법률에 규정된 내용에 따라 계약 종료에 따른 연락 및 비용을 분명히 하여야 합니다.​"
687,월세,"안녕하세요 전문가분들에게 문의드립니다.인천 송도에 10억 자가 소유 상가 월세 175만원 수입(부동산 일반 사업자 신고)그런데 평택에 8천 대출을 받아서 3.8억에 아파트를 구매하려고 합니다.그리고 월세를 110만원에 놓으려고 하는데요여기서 질문사항이1. 1가구 2주택 해당되는지요2. 세금관계는 부동산 관련 연간재산세만 내면 되는지요? 약 40만원 추정3. 나중에 집을 송도는 보유하고 나중에 산 평택집을 처분할껀데 5년이내 세금관계4. 월세 110만원에 대한 사업자 신고 별도로 해야하는지 아니면 1가구2주택 관계없이 별도 과세로 종합소득세 신고만 하면 되는건지, 아니면 상가와 같이 묶어서 신고해야하는지 궁금합니다.부동산 전문가님들의 고견을 기다립니다.","1가구 2주택 적용 여부- 부동산 소유는 송도 상가와 평택 아파트 둘 다 소유하고 있는 것으로 보입니다. 이 경우 1가구 2주택 적용이 됩니다. 세금관계- 연간재산세 외에도 지방소득세와 종합소득세를 납부해야 합니다. - 월세 수입이 부가가치세법상 용역 과세 대상이므로, 부동산 일반 사업자 신고를 통해 부가세를 납부하는 것이 필요합니다. 집 처분 시 세금관계- 아파트를 처분할 경우 양도소득세가 발생할 수 있습니다. - 양도소득세는 양도한 자산의 가액에서 매입가액, 취득세, 개량비 등을 공제한 금액의 일정 비율에 따라 부과됩니다. - 이 경우, 5년 이내에 처분할 경우 양도소득세가 더 높아지므로, 최소 5년 이상 보유 후 처분하는 것이 유리합니다. 월세 110만원에 대한 세금 신고- 월세 수입은 일반소득에 해당되므로, 종합소득세 신고를 통해 납부해야 합니다. - 부동산 일반 사업자 신고와 별도로 월세 수입을 신고할 필요는 없습니다."
688,월세,"안녕하세요이사를 준비하면서월세 보증금 2000/70 짜리 오피스텔 계약을 앞두고있는데전입신고가 불가능하다고 합니다.집주인쪽에서 건물특성상 전세권설정은 불가능하고질권설정, 근저당설정은 가능하다고합니다.1. 질권설정과 근저당설정이 무엇인지 임차인 입장에서 간단하게 설명부탁드립니다.2. 질권설정, 근저당설정시 월세 보증금을 보호할수 있는지 궁굼합니다.3. 질권설정, 근저당설정 법무사 대행시 대락적인 비용이 궁굼합니다.","가급적 근저당 설정이 바람직해 보입니다. 근저당 설정으로 보증금 보호를 받을 수가 있습니다. 질권설정은 큰 의미가 없고, 근저당설정시 대략 50만원 정도 소요됩니다."
689,월세,제가 월세로 부동산계약을 하려고합니다.현 집주인이 19일에 집을팔아 새집주인이 등기이전을 하는데 계약을 10일에 해도 상관없는건가요?,"부동산 월세 계약을 하려면 해당 부동산의 소유자, 즉 집주인과 계약을 해야합니다. 만약 현재 집주인이 집을 판매하고 새로운 주인이 등기 이전을 하고 있다면, 이전 주인이 아직 소유자로 남아있기 때문에 계약이 가능합니다.​다만, 계약서 작성 시 해당 부동산의 매매 계약 상태와 등기 상태를 반드시 확인하시는 것이 좋습니다. 이전 주인과 새로운 주인 모두 계약서 상에 기재되어 있어야 하며, 등기 이전이 완료되지 않은 경우 해당 계약서는 유효하지 않을 수 있습니다. 따라서, 계약서 작성 전에 부동산 등기부 등 관련 서류들을 확인하는 것이 좋습니다.​"
690,월세,"우선 저는 오피스텔 임대인으로서 있는 입장입니다.2020.12 ~ 2021.12월 까지 월세로 최초 1년계약을 하였고, 현재 계약만기 전 6개월~2개월전까지 아무말도 없었던 상태라 묵시적갱신으로 넘어간 상태입니다.근데 현재 확인을 해보니, 주변월세보다 제 임대계약이 현저히 낮게 측정이 되어있어서 월세를 올리거나 임차인을 내보내고 싶은 입장입니다.1.현재 묵시적갱신이 이루어졌음에도 월세를 5%인상이 가능한가요?(주변시세대비 현저히낮음)2.최초계약이 1년이니 묵시적갱신도 1년계약인가요?3.묵시적갱신이1년이라면 2021.12 ~ 2022.12월까지인데 계약 만기 시 최초계약기준(2020.12) 2년 후인 2022.12월에는 세입자에게 나가라고 할 수 있는 상태가 되는건가요?그때 계약갱신청구권을 쓰는건가요?4.혹시 오피스텔의 명의가 타인에게 넘어가더라도 앞서말한 모든 계약은 유지되고 계약갱신청구권도 행사할수있는가요?5.3번처럼 최초계약2년후에 임대인이 거주한다는 사유로 나가라고할 수 있는걸로 아는데, 법정으로 명시된 거주 기간 같은건 있는가요?옅은 지식으로 혼란스러운게 많아 어렵네요ㅜㅜ","1년 이내에 차임 인상이 없었다면 차임 인상 청구 가능합니다. 묵시적 갱신은 2년 입니다. 다만 임차인은 그 보다 적은 기간을 주장할 수 있고 해지도 가능합니다. 묵시적 갱신 2년 이후에 임차인 입장에서 갱신청구권 사용 가능합니다. 임대차계약의 대항력이 있다면 신소유자도 임대차계약에 구속되며 계약 내용이 그대로 승계된다고 보시면 됩니다. 임대인, 직계존속, 직계비속이 직접 거주하시면 되며, 법정으로 명시된 거주 기간은 없고 사회통념상으로 판단하게 되어 있습니다. 너무 짧은 기간동안 거주하다가 이사를 가면 실제 거주 의사가 없었다고 판단할 수도 있습니다."
691,월세,만약 월세 20짜리방에 1월5일 보증금 100만원 계약금 20을 선납하고  들어온후.  1 .2기 연체하면 계약해지  할수있다고 구두로 적어놓고 3월5일까지  돈한푼도 안내서 2기 연체하면 주인맘대루 계약해지 통보하고 계약해지할수있나요? 2 4월 5일까지 나가라고 한달전에 통보한다음 4월5일날 안나가면 주인이 문따고 들어가서 짐마음대로 뺄수있나요? 3그리고 부동산 계약서 팩스로 주고 받을시 효력이있나요? 궁금합니다.,​주택임대차보호법 제6조의 3에 의하면 임대인은 임차인이 2기의 차임액에 해당하는 금액에 이르도록 차임을 연체한 사실이 있는 경우에는 임차인의 계약갱신을 거절하고 임대차계약을 해지 할 수 있습니다. 우선 임차인에게 차임 2기분을 연체히여 계약을 해지한다는 내용증명을 보내신후 점유이전금지가처분과 명도 소송을 진행하여야 합니다.​차임 2기분을 연체하였다고 하여 임대차기간이 만료된 후 강제로 문을 열고 집에 들어간 후 물건들을 뺄 경우에는 형사상 주거칩임죄와 절도죄가 성립할 수 있습니다.
692,월세,"신탁원부에는 서면동의서를 지참하여 임대차 계약을 진행한다고 적혀있었으나 실제 계약때 동의서는 없었습니다.부동산쪽에선 신탁회사는 돈 빌려주는 회사라서 실무상 동의서 받기가 불가능하다고 합니다. 그러면서 입주할 때 전입신고, 확정일자 받으면 대항력 갖는다고 하네요.신탁부동산의 경우 우선수익자, 수탁자의 서면동의서나 동의확인서 없이 계약을 진행할 경우, 전입신고와 확정일자 만으로 대항력을 갖출 수 있나요?담보신탁이며, 신탁원부 상 우선수익자는 은행, 수탁자는 신탁회사가 적혀있었습니다. 그러면 임대차 동의서는 신탁회사가 아닌 은행으로부터 받아야하는 건가요?","​신탁등기된 부동산은 그렇지 않은 부동산보다 권리관계가 복잡한 편이기 때문이 임대차 계약을 체결하실 때 각별한 주의를 기울이셔야 합니다. 일반적인 임대차 계약 관계는 임대인, 임차인이 당사자가 되는데, 신탁등기가 설정된 임대차 계약의 경우에는 위탁자, 수탁자, 수익자, 임차인이 당사자가 됩니다. 수탁자(일반적으로 신탁회사)가 아닌 위탁자와 임대차 계약을 체결하면 임대차 계약의 효력 자체가 부정될 수 있습니다. ​이 경우 당연히 우선변제권이나 최우선변제권을 주장할 수 없습니다. 보통 신탁회사의 동의를 받는데 신탁회사의 동의를 받는다고 해서 보증금이 보호되는 것은 아닙니다. 최근 신탁등기를 악용한 전세사기가 기승을 부리고 있는데 이에 해당사항이 없는지 검토해보시는 것도 필요해보입니다."
693,월세,부동산에서 월세 계약하려고 하는데요! 아무것도 몰랐어요!아무것도 모르는 초보자입니다!부동산 월세 어떻게 해야 되는지 자세히 알고 싶어요! 부동산 전문가 여러분이 자세히 계약하는 방법 및 주의 사항 알려주세요!,"등기부 발급해서 소유자 확인(갑구), 보증금 보호 때문에 근저당 등이 있는지? 확인해야 합니다.1,000만원~2,000만원 정도이면 크게 신경은 안 써도 됩니다. 소유자, 대출 확인,누수, 결로, 소음, 보일러, 샷시 등 문제 없는지? 확인을 잘하면 됩니다."
694,월세,질문이 두가지인데 양해부탁드립니다. 부동산 계약이 엄청 스트레스 받네요.1. 이번에 월세를 양도 받는데요.집주인과 계약을 해야하는 상황인 것 같습니다.다음주에 계약할 예정이였습니다.집주인이 부동산한테 권리를 위임했대요.그러면 위임장이 있어야하잖아요?제가 계약서 내용 확인을 미리하고 싶어서 위임받았다는 부동산 분한테 연락했고연락한 김에 위임장 볼 수 있냐 그랬더니자기 개인정보를 왜 보여주냐고 불같이 화를 내더라고요.원래 보여줄 수 없나요? 아니면 보여주는 건 상관없지만 대부분이 보여주길 꺼려하나요? 미심쩍어서 여쭤봅니다.2. 방금 위임받았다던 부동산한테서 연락이 왔는데 직접 위임받은 것이 아니라 건물이 가까워 관리만 돕는거라네요.위임이 미심쩍으면 자기랑 계약할 때 와서 집주인의 주민등록번호랑 집주인 등본 확인하라네요믿을만 한건가요ㅜ,부동산 계약시 위임장을 받은 부동산 대리인이 계약을 할수있습니다​보통 부동산 대리인(중개사무소) 등에 계약이 있으면 그때  집주인이 위임장을 보내는데...요즘은 보통 문자같은걸로​위임합니다 이렇게 남기면서 자신의 신분증등을 보내더라구요​물론 도장과 등본등은 집주인이 직접보내고 집주인의 위임장과 신분증 정보등을 확인하시면서​집의 등기부등본에 나온 집주인과 확인해서 위임이 정확한건지 확인을 합니다​월세계약을 하신다면​가장 먼저 하실내용은 ​집주소의 등기부등본을 떼보시고 집주인확인과 을구의  대출내용을 확인합니다​본인이 들어가기전에 집값의 시세를 확인하시어 집값에 비해 너무 많은 대출이 있으면​본인의 보증금을 보전받지못할수도있습니다​
695,월세,가계약으로 첫달 월세 33만원 이체한 상태구요본계약은 입주날 그 방에서 만나서 하기로 했습니다부동산이 아니라 방에서 하는 게 편법이라는데 이유가 있을까요? 다른 것도 제가 확인해봐야 할 사항이 더 있을까요?,"부동산 월세 계약은 일반적으로 부동산 중개사무소나 부동산 회사에서 진행하는 것이 일반적입니다. 그러나 입주날 그 방에서 계약을 진행하는 것은 편법이라고 할 수는 없지만, 일반적인 절차와는 다를 수 있습니다. 이유는 다양할 수 있으며, 예를 들어, 계약 당사자들이 서로의 상황을 더 자세히 알고 싶어서 직접 만나서 계약을 진행하는 경우도 있을 수 있습니다.​다른 확인해야 할 사항은 다음과 같습니다:1. 계약 기간: 월세 계약의 기간을 명확히 알아야 합니다. 보통은 1년 계약이 일반적이지만, 당사자들 간에 합의된 기간이 있을 수 있습니다.2. 보증금: 월세 계약 시에는 일반적으로 보증금을 지불해야 합니다. 보증금의 액수와 반환 조건을 확인해야 합니다.3. 월세 지불 방법: 월세를 어떤 방식으로 지불해야 하는지 확인해야 합니다. 이체, 현금 등의 방법이 있을 수 있습니다.4. 계약 해지 조건: 계약을 해지하고자 할 때의 조건과 절차를 확인해야 합니다.5. 부속 시설 및 유지 보수: 월세에 포함된 부속 시설이나 유지 보수에 대한 책임과 조건을 확인해야 합니다."
696,월세,안녕하세요 부동산 월세 처음 계약하는데 집주인분이 호주인이고 현재 호주에 거주하고있어서 부동산측에 계약금 입금을 한 상태입니다 특약사항에 집주인이 부동산측에 위임한다라는 특약내용이 있습니다 특약내용 임대인은 임차인 계약금을 부동산을 통해 현재 거주자에게 전세금을 반환한다 라는 특약이 있고 일전에 살던 현재 거주자 전세 계약서도 동일한 특약이 있습니다 일전 전세계약도 똑같은 상황에서 거래한것으로 판단되는데 혹시 위험할까여?,"​일반적으로는 집주인이 직접 입주 중인 거주자에게 계약금을 반환하고 이후 월세계약을 체결하는 경우는 드뭅니다. 따라서 현재의 상황이 약간 이상하게 느껴집니다.​특약 내용상으로는 임차인이 부동산측을 통해 전세금을 집주인에게 반환하는 것으로 보이며, 이러한 경우 일반적으로는 계약금 입금 후에도 변동이 없어야 하지만, 위험을 완전히 배제할 수는 없습니다. 또한 집주인이 외국에 거주하고 있다는 점도 추가적인 위험요소가 될 수 있습니다."
697,월세,안녕하세요. 월세 계약을 하려고 하는데 안전한지 문의드립니다.금액 : 4000/80정보 : 1) 공동주택 등록 (도시생활주택)       2) 신축 다세대 빌라 (주인은 한분이신데 세대별로 등기되어 있습니다.)       3) 근저당은 40억 정도인데          전체 빌라 대상으로 잡혀있습니다. (공동담보로 기재)       4) 전세 매물 보증보험 가입 가능       5) 월세 매물은 4000이라 최우선 변제금액 해당 (카카오 대출도 가능)          : 근저당이 2022년이 최초인데 4300까지 보증되는 지역입니다.근저당이 빌라 전가구에 대해 잡혀있어 크기는 한데 (세대수가 25세대 정도 됩니다.)월세 보증금이 4000이하라 최우선 변제금액에 해당하고전세 시 보증보험도 가입되는 빌라라 크게 문제는 없을 것 같다는 생각이 듭니다.요새 부동산 사기로 피해보는 사례들이 많아 걱정이 됩니다.건축물대장을 봐도 특이사항이 없는데제가 추가적으로 확인해봐야 할 내용이 있을까요?,최우선변제금 4300은 2021.5.11 이후에 저당권이 설정되면 적용을 하는 것이므로 보증금이 4000아면 편하게 눈감고 계약을 해도 되는 것이지요.
698,월세,"부동산에 문의해서 월세 계약을 했는데,월세가 밀려있는데도 연랃이 안옵니다.. (18년11월 계약)월세 계약은 구두계약 이라고 되있다던데여러가지 궁금한게있습니다1. 제가 따로 연락드리지않고 나가서 살게되면 어떻게되나요?2. 제가 월세로 들어갔던 금액 그대로해서 다른사람에게 대체로 와서 살게하는 방법은 없나요?(미납 잔금은 모아서 드리려고합니다.)도와주세요 부동산에 대해 아무것도 몰라 걱정되어 여기에라도 문의합니다...",밀린 부분 임대인이 모르거나​신경 크게 안쓰는 부분일 수 있습니다.​보증금이 있으니.​​임대인 동의없이 다른 사람을 살게하는건​위반 사항이여서​임대인동의가 있으면 가능합니다.
699,월세,이번에 원룸 월세를 계약 연장을 하는데 처음 계약할때는 보증금 500/40이였는데 이번에는 500/45로 올랐어요 그래서 제가 연장을 한다고 하고 따로 작성할게 없냐고 여쭤봤는데 한달 전에는 작성하지 않아도 된다고 하셨는데 이번에 전화가 와서 법이 바뀌었다면서 처음에 전입신고했었냐며 새로 계약서를 작성해야 하고 부동산에서 수수료 20만원을 또 내야 한다고 하는데 이게 맞는건가요??,"부동산 월세계약은 당사자사이의 합의로 계약서를 작성하여도 유효합니다.​-굳이 부동산중개소를 가실 필요는 없습니다.​-부동산중개소를 가게 된다면, 계약서 작성에 도움을 주었다는 의미로 수수료를 받을 수 있습니다. 보통은 계약서만 작성하면 실비만 받는 경우가 많습니다"
